StockCode,Description,TotalQuantity,TotalRevenue,OrderCount
20782,CAMOUFLAGE EAR MUFF HEADPHONES,40,221.35999999999999,17
84563B,BLUE & WHITE BREAKFAST TRAY,73,221.35000000000002,21
37482P,CUBIC MUG PINK POLKADOT,489,220.95,34
85186A,EASTER BUNNY GARLAND OF FLOWERS,525,220.5,37
84422,PINK/BLUE DISC/MIRROR STRING,551,220.41,8
47422,ASSORTED MONKEY SUCTION CUP HOOK,555,220.14000000000001,42
72800D,4 BLUE DINNER CANDLES SILVER FLOCK,86,219.29999999999998,29
79030D,"TUMBLER, BAROQUE",462,217.98,30
23580,SNACK TRAY HAPPY FOREST  ,111,216.45,21
90160A,PURPLE BOUDICCA LARGE BRACELET,31,215.45000000000002,11
23141,TRIPLE WIRE HOOK PINK HEART,68,215.00000000000003,18
85124C,GREEN JUICY FRUIT PHOTO FRAME,84,214.2,31
84931A,PINK SCOTTIE DOG W FLOWER PATTERN,84,214.2,22
21293,MIRRORED DOVE WALL DECORATION,101,214.13000000000002,18
20794,BLUE  TILE HOOK,85,213.14999999999998,15
22410,MONEY BOX HOUSEKEEPING DESIGN,223,212.88,46
84051,ASS COLOUR GLOWING TIARAS,280,212.79999999999998,24
17084N,FAIRY DREAMS INCENSE ,1025,212.75,32
21547,CERAMIC BIRDHOUSE CRESTED TIT SMALL,72,212.40000000000003,16
84584,PINK GINGHAM CAT WITH SCARF,83,211.64999999999998,18
75178,ASSTD COL BUTTERFLY/CRYSTAL W/CHIME,455,210.19,9
22164,STRING OF STARS CARD HOLDER,71,209.45000000000005,12
85124B,BLUE JUICY FRUIT PHOTO FRAME,82,209.1,29
90147,CHUNKY SILVER NECKLACE PASTEL FLOWE,21,208.95,12
72127,COLUMBIAN CANDLE ROUND ,168,208.1,29
84592,CROCHET ROSE PURSE WITH SUEDE BACK,70,206.50000000000003,17
22954,HEN PARTY CORDON BARRIER TAPE,165,206.25,28
20619,TROPICAL PASSPORT COVER ,142,206.23000000000002,22
85071D,CHARLIE+LOLA MY ROOM DOOR SIGN,362,205.98,64
84596J,MIXED NUTS LIGHT GREEN BOWL,469,205.28,27
21324,HANGING MEDINA LANTERN SMALL,69,203.55,20
85230A,OPIUM SCENTED VOTIVE CANDLE,840,203.27999999999997,18
21580,RABBIT  DESIGN  COTTON TOTE BAG,90,202.5,24
21758,VINTAGE SHELLS PRINT,32,202.4,14
21651,HANGING GLASS ETCHED TEALIGHT,131,201.74999999999997,10
84919,BLUE CUSHION COVER WITH FLOWER,29,201.55,9
21456,2 PICTURE BOOK EGGS EASTER CHICKS,161,201.25,19
21147,JINGLE BELLS TREE DECORATION,89,200.94,21
44235,ASS COL CIRCLE MOBILE ,539,200.45999999999998,13
16156L,"WRAP, CAROUSEL",475,199.5,18
22038,BOTANICAL LAVENDER GIFT WRAP ,475,199.5,19
20780,BLACK EAR MUFF HEADPHONES,37,198.35000000000002,17
84857C,PINK MONTE CARLO HANDBAG,95,198.35,8
84926A,WAKE UP COCKEREL TILE COASTER,597,198.08999999999997,31
84563A,PINK & WHITE BREAKFAST TRAY,59,198.05,14
21458,2 PICTURE BOOK EGGS EASTER BUNNY,158,197.5,19
22044,CHRISTMAS CARD STACK OF PRESENTS,816,196.44,36
21726,MULTI HEARTS  STICKERS,231,196.35,36
85170B,SET/6 BLACK BIRD T-LIGHT CANDLES,179,195.9,23
20707,CRAZY DAISY HEART DECORATION,155,195.52,31
21000,ROSE DU SUD COSMETICS BAG,46,195.5,16
20652,BLUE POLKADOT LUGGAGE TAG ,150,194.76,33
21657,MILK BOTTLE WITH GLASS STOPPER ,28,194.60000000000002,15
47367B,PAIR PADDED HANGERS PINK CHECK,57,194.55,11
22257,FELT FARM ANIMAL SHEEP,283,194.39,16
21360,JOY LARGE WOOD LETTERS,37,194.15,14
35911A,MULTICOLOUR RABBIT EGG WARMER,205,194.14999999999998,25
21253,SET OF PICTURE FRAME  STICKERS,66,192.54000000000002,16
21801,CHRISTMAS TREE DECORATION WITH BELL,457,191.94,22
85169B,BLACK LOVE BIRD CANDLE,201,191.49,25
21815,STAR  T-LIGHT HOLDER ,132,191.39999999999998,18
21882,SKULLS TAPE,600,191.28000000000003,38
84876D,BLUE HEART COMPACT MIRROR,125,191.25,12
90209B,GREEN ENAMEL+GLASS HAIR COMB,105,191.1,11
21676,FLOWERS  STICKERS,211,191.04999999999998,32
22137,BATHROOM SET LOVE HEART DESIGN,68,191.0,11
22394,PAPERWEIGHT KINGS CHOICE ,160,190.79999999999998,16
21945,STRAWBERRIES  DESIGN FLANNEL ,225,190.79,29
20902,VINTAGE KEEPSAKE BOX PARIS DAYS,33,190.35,6
20763,DAISY SKETCHBOOK ,71,189.96,25
21161,KEEP OUT BOYS DOOR HANGER ,131,189.95,34
90201B,BLACK ENAMEL FLOWER RING,64,188.8,10
84804B,BLUE DELPHINIUM ARTIFICIAL FLOWER,99,188.37000000000003,6
85179A,GREEN BITTY LIGHT CHAIN,119,188.31,17
21425,SKULLS STORAGE BOX LARGE,67,188.05,16
90184B,AMETHYST CHUNKY BEAD BRACELET W STR,21,187.95,11
21520,BOOZE & WOMEN GREETING CARD ,457,187.62,33
16048,TEATIME ROUND PENCIL SHARPENER ,1437,186.84,47
85045,GREEN CHRISTMAS TREE STRING 20LIGHT,41,186.15,10
22391,PAPERWEIGHT HOME SWEET HOME,146,186.05999999999997,18
84535A,ENGLISH ROSE NOTEBOOK A6 SIZE,398,185.1,20
20819,SILVER TEDDY BEAR,48,183.71,16
84559B,3D SHEET OF CAT STICKERS,216,183.6,43
20771,CHRYSANTHEMUM  JOURNAL,71,183.45999999999998,27
22216,T-LIGHT HOLDER WHITE LACE,327,182.31,20
35965,FOLKART HEART NAPKIN RINGS,181,181.87,28
22541,MINI JIGSAW LEAP FROG,466,181.04,21
84804A,CREAM DELPHINIUM ARTIFICIAL FLOWER,70,180.58,8
22157,ANGEL DECORATION WITH LACE PADDED,212,180.2,11
23697,A PRETTY THANK YOU CARD,438,179.64,26
78033,FLAG OF ST GEORGE CHAIR,37,179.35,7
84707B,PINK JEWELLED MIRROR TRINKET TRAY,29,178.56,13
21270,ANTIQUE CREAM CUTLERY CUPBOARD,14,178.5,13
84796A,PINK HAWAIIAN PICNIC HAMPER FOR 2,14,178.5,10
84926F,PSYCHEDELIC TILE COASTER,423,178.0,23
21944,KITTENS DESIGN FLANNEL,232,177.88,33
47594B,SCOTTIES DESIGN WASHBAG,91,177.45,30
21026,SPACE OWL,143,177.37,22
84859C,PINK DISCO HANDBAG,83,176.39,21
84313B,BLUE TV TRAY TABLE ,76,175.8,13
21378,SMALL TALL CAMPHOR WOOD TOADSTOOL,129,175.04999999999998,22
84691,PACK 20 DOLLY PEGS,242,174.5,4
84800M,MEDIUM WHITE/PINK ROSE ART FLOWER,127,174.31,11
21807,WHITE CHRISTMAS STAR DECORATION,415,174.29999999999998,25
90200A,PURPLE SWEETHEART BRACELET,41,174.25,16
85186C,BUNNY EGG GARLAND,413,173.46,33
21911,GARDEN METAL SIGN ,105,173.24999999999997,20
20769,DAISY JOURNAL ,66,173.11999999999998,26
84637,KITCHEN FLOWER POTS WALL PLAQUE,29,172.55,13
20847,ZINC HEART LATTICE CHARGER LARGE,46,172.5,14
84913A,SOFT PINK ROSE TOWEL ,37,172.05,10
82011C,BATHROOM SCALES FOOTPRINTS IN SAND,51,172.05,20
84963A,PINK PAINTED KASHMIRI CHAIR,4,171.8,1
90082B,DIAMANTE BOW BROOCH RED COLOUR,27,171.45,10
85214,TUB 24 PINK FLOWER PEGS,103,169.95,43
21763,VINTAGE WOODEN BAR STOOL,6,169.75,4
21656,RIDGED GLASS POSY VASE ,117,169.64999999999998,17
21275,ZINC TOP  2 DOOR WOODEN SHELF ,10,169.5,9
21364,PEACE SMALL WOOD LETTERS,25,168.75,21
84875B,GREEN SQUARE COMPACT MIRROR,125,168.75,15
90114,SUMMER DAISIES BAG CHARM,66,168.29999999999998,11
47578A,ENGLISH ROSE SMALL SCENTED FLOWER,198,168.29999999999998,27
85145,JARDIN ETCHED GLASS LARGE BELL JAR,38,167.70000000000002,13
62086A,PINK RETRO BIG FLOWER BAG,86,167.7,13
47469,ASSORTED SHAPES PHOTO CLIP SILVER ,359,167.10999999999999,11
21306,SET/4 DAISY MIRROR MAGNETS,487,166.57,36
84927F,PSYCHEDELIC TILE HOOK,295,166.35,40
21311,SET/4 BIRD MIRROR MAGNETS ,478,165.76999999999998,44
21280,VINTAGE KITCHEN PRINT VEGETABLES,65,165.75,12
21279,VINTAGE KITCHEN PRINT FRUITS,65,165.75,12
BANK CHARGES,Bank Charges,12,165.001,11
22889,NUMBER TILE VINTAGE FONT No ,147,164.58,7
47481,50CM METAL STRING WITH  7 CLIPS,222,164.22,19
46118,FUNKY MONKEY CUSHION COVER,193,164.04999999999998,18
90209A,PURPLE ENAMEL+GLASS HAIR COMB,84,163.8,4
21750,LARGE SKULL WINDMILL,78,163.8,16
85020,ROUND PINK HEART MIRROR,78,163.8,16
72801C,4 ROSE PINK DINNER CANDLES,138,163.38,14
21379,CAMPHOR WOOD PORTOBELLO MUSHROOM,147,163.11,23
35914,PINK CHICK EGG WARMER + EGG CUP,136,163.1,18
21333,CLASSIC WHITE FRAME,55,162.25,15
21427,SKULLS STORAGE BOX SMALL,77,161.70000000000002,25
20781,GOLD EAR MUFF HEADPHONES,32,161.52,20
84507C,BLUE CIRCLES DESIGN MONKEY DOLL,63,160.64999999999998,25
85027L,FRENCH CHATEAU LARGE PLATTER ,70,160.5,18
37476,CONDIMENT TRAY 4 BOWLS AND 4 SPOONS,17,160.39,9
23305,SET 4 PICNIC CUTLERY BLUEBERRY,82,159.9,9
21367,MIRRORED WALL ART GENTS,163,159.51,35
71403,"PINK/WHITE ""KEEP CLEAN"" BULLET BIN",54,159.3,13
20868,SILVER FABRIC MIRROR,381,159.26000000000002,31
72225C,LAVENDER SCENT CAKE CANDLE,600,158.64,16
22031,BOTANICAL LAVENDER BIRTHDAY CARD,363,158.61,32
22289,HANGING METAL CHICKEN DECORATION,126,157.5,19
20830,SILVER PHOTO FRAME,75,157.5,20
84877B,GREEN ROUND COMPACT MIRROR,126,157.5,9
23143,ZINC WIRE KITCHEN ORGANISER,25,156.8,12
23468,TUSCAN VILLA BIRD TABLE ,19,156.75,11
20777,CHRYSANTHEMUM NOTEBOOK,95,156.75,36
21316,SMALL CHUNKY GLASS ROMAN  BOWL,149,156.59,9
16258A,SWIRLY CIRCULAR RUBBERS IN BAG,445,156.53,38
22042,CHRISTMAS CARD SINGING ANGEL,372,156.24,25
22353,LUNCH BOX WITH CUTLERY FAIRY CAKES ,61,155.54999999999998,24
84799,SPRIG LAVENDER ARTIFICIAL FLOWER,220,155.48,9
21402,RED  EGG  SPOON,1290,155.4,61
23416,CHAMBRE HOOK,123,155.06999999999996,18
35810B,ENAMEL BLUE RIM COFFEE CONTAINER,147,155.03,21
40003,WHITE BAMBOO RIBS LAMPSHADE,147,154.95,11
21376,LARGE  TALL CAMPHOR WOOD TOADSTOOL ,33,154.65,13
84827,ASS DES PHONE SPONGE CRAFT STICKER,511,154.39,14
21030,SPACE CADET RED,121,153.67,21
90161D,ANT COPPER PINK BOUDICCA BRACELET,31,153.45000000000002,9
90201C,RED ENAMEL FLOWER RING,52,153.4,12
18094C,WHITE AND BLUE CERAMIC OIL BURNER,134,153.1,15
21145,ANTIQUE GLASS PLACE SETTING,122,152.5,8
85211,S/4 GROOVY CAT MAGNETS,142,151.92,17
22032,BOTANICAL LILY GREETING CARD,361,151.62,31
22538,MINI JIGSAW GO TO THE FAIR,387,151.5,26
22415,WHITE TISSUE REAM,19,151.05,13
35967,FOLK ART METAL STAR T-LIGHT HOLDER,381,150.54000000000002,29
47471,RAINBOW PEGS PHOTO CLIP STRING,264,150.18,24
35915B,BLUE KNITTED HEN ,91,150.14999999999998,14
84629,WHITE 3 FRAME BIRDS AND TREE ,20,150.0,10
84963B,BLUE PAINTED KASHMIRI CHAIR,3,149.85000000000002,1
85168B,BLACK BAROQUE CARRIAGE CLOCK,17,149.67,7
84711B,PINK OVAL SHAPE TRINKET BOX,15,149.25,8
21117,BLOND DOLL DOORSTOP,115,149.25,14
21721,CANDY SHOP  STICKER SHEET,175,148.75,20
21001,ROSE DU SUD WASHBAG ,25,148.75,12
90119,METALIC LEAVES BAG CHARMS,60,148.32,15
21028,NINJA RABBIT BLACK,116,148.29,21
84712B,PINK JEWELLED PHOTO FRAME,19,147.87,11
85146,JARDIN ETCHED GLASS SMALL BELL JAR,43,147.85000000000002,8
84683,CLASSICAL ROSE CANDLESTAND,187,147.35000000000002,7
21196,ROUND WHITE CONFETTI IN TUBE,89,146.84999999999997,9
46000R,POLYESTER FILLER PAD 45x30cm,101,146.45,37
22202,MILK PAN PINK POLKADOT,39,146.25,17
21459,YELLOW EASTER EGG HUNT START POST,75,146.25,18
84952A,CLEAR LOVE BIRD T-LIGHT HOLDER,38,146.21,6
35957,SMALLFOLKART BAUBLE CHRISTMAS DEC,558,146.04000000000002,7
90160B,RED BOUDICCA LARGE BRACELET,21,145.95000000000002,8
72128,COLUMBIAN CANDLE ROUND,189,145.53,33
84508B,STRIPES DESIGN TEDDY,57,145.35,30
47343A,FUSCHIA FLOWER PURSE WITH BEADS,159,145.17,14
84688,BEACH HUT DESIGN BLACKBOARD,34,144.5,8
90198A,VINTAGE ROSE BEAD BRACELET RASPBERR,34,144.5,10
21457,2 PICTURE BOOK EGGS EASTER DUCKS,115,143.75,16
84192,ASSORTED COLOUR METAL CAT ,115,143.75,25
21332,MOROCCAN BEATEN METAL MIRROR,14,143.3,8
79190A,RETRO PLASTIC 70'S TRAY,340,142.8,34
21132,SILVER STANDING GNOME   ,35,142.75,16
90143,SILVER BRACELET W PASTEL FLOWER,19,142.5,7
21369,MIRRORED WALL ART SPLODGES,98,142.5,13
20837,FRENCH FLORAL CUSHION COVER ,141,142.47,15
23694,PAISLEY PARK CARD,348,141.84,24
21614,SET OF 12 ROSE BOTANICAL T-LIGHTS,48,141.60000000000002,7
22408,MONEY BOX CONFECTIONERY DESIGN,137,141.5,22
22033,BOTANICAL ROSE GREETING CARD,336,141.12,21
84247G,"DECOUPAGE,GREETING CARD,",336,141.12,23
20836,FRENCH PAISLEY CUSHION COVER,170,141.1,17
20659,ECONOMY LUGGAGE TAG,95,140.81,29
16054,POPART RECT PENCIL SHARPENER ASST,1166,140.52,33
21331,MOROCCAN BEATEN METAL DISH LARGE,11,140.25,7
21555,CERAMIC STRAWBERRY TRINKET TRAY,55,140.25,12
20757,RED DAISY POCKET BOOK ,164,140.18,30
82011B,BATHROOM SCALES RUBBER DUCKS,41,139.35,19
84711A,SILVER OVAL SHAPE TRINKET BOX,14,139.29999999999998,7
21344,MOROCCAN BEATEN METAL DISH,14,139.29999999999998,5
75011,BLUE DAISY MOBILE,172,138.76,12
21851,LILAC DIAMANTE PEN IN GIFT BOX,26,138.72,15
90201A,PURPLE ENAMEL FLOWER RING,47,138.65,11
84429A,MEDIUM PINK BUDDHA HEAD ,47,138.65,14
35653,VINTAGE BEAD NOTEBOOK,47,138.65,17
35922,EASTER BUNNY WREATH,28,138.6,10
23304,SET 4 PICNIC CUTLERY CHERRY ,71,138.45,9
16168M,FUNKY MONKEY GIFT BAG MEDIUM,329,138.18,20
17038,PORCELAIN BUDAH INCENSE HOLDER,1501,138.1,19
20618,QUEEN OF THE SKIES PASSPORT COVER ,68,137.88000000000002,28
23417,BATHROOM HOOK,140,137.76,21
20617,FIRST CLASS PASSPORT COVER ,66,137.74,26
22769,CHALKBOARD KITCHEN ORGANISER,6,137.7,3
21736,GOLD SCROLL GLASS T-LIGHT HOLDER,80,137.22000000000003,5
20758,ABSTRACT CIRCLES POCKET BOOK,161,136.85,41
21637,ASSORTED SANSKRIT MINI NOTEBOOK,109,136.25,6
90185D,CRYSTAL DIAMANTE EXPANDABLE RING,32,136.0,8
85118,HEART T-LIGHT HOLDER,142,135.74,6
90201D,GREEN ENAMEL FLOWER RING,46,135.70000000000002,9
84631,FRUIT TREE AND BIRDS WALL PLAQUE,17,135.15,9
20694,FLORAL PINK MONSTER,36,135.0,10
84744,S/6 SEW ON CROCHET FLOWERS,108,135.0,18
22869,NUMBER TILE COTTAGE GARDEN 1,69,134.54999999999998,19
21942,SKULLS DESIGN FLANNEL,161,134.54999999999998,23
46000U,POLYESTER FILLER PAD 30CMx30CM,107,133.75,26
90082A,DIAMANTE BOW BROOCH GREEN COLOUR,21,133.35,10
84661A,WHITE SQUARE TABLE CLOCK,94,132.99,11
21738,COSY SLIPPER SHOES SMALL  RED ,45,132.75,18
84508C,BLUE CIRCLES DESIGN TEDDY,52,132.6,20
62096A,PINK/YELLOW FLOWERS HANDBAG,106,132.5,8
21401,BLUE PUDDING SPOON,1010,132.29999999999998,58
84638,SMALL KITCHEN FLOWER POTS PLAQUE,19,132.05,12
90030B,RED KUKUI COCONUT SEED NECKLACE,112,131.8,15
90120C,GREEN MURANO TWIST BRACELET,31,131.75,7
79191B,RETRO PLASTIC POLKA TRAY,154,130.9,26
22870,NUMBER TILE COTTAGE GARDEN 2,67,130.65,15
22124,SET OF 2 TEA TOWELS PING MICROWAVE,79,130.37,23
22395,PAPERWEIGHT VINTAGE PAISLEY,134,130.26,15
85039C,S/4 BLACK MINI ROSE CANDLE IN BOWL,222,129.94,12
20823,GOLD WINE GOBLET,164,129.56,7
21319,GLASS CHALICE GREEN  SMALL ,147,129.51,12
21368,MIRRORED WALL ART LADIES,161,129.15,30
20826,SILVER APERITIF GLASS,276,128.4,8
85095,THREE CANVAS LUGGAGE TAGS,66,128.26,10
84993A,75 GREEN PETIT FOUR CASES,305,128.1,33
84800S,SMALL WHITE/PINK ROSE ART FLOWER,113,127.57000000000001,9
90198B,VINTAGE ROSE BEAD BRACELET BLACK,30,127.5,11
84882,GREEN WIRE STANDING CANDLE HOLDER,34,127.5,15
21025,SPACE FROG,100,127.25,16
85130A,BEADED PEARL HEART WHITE LARGE,77,127.04999999999998,10
20903,VINTAGE KEEPSAKE BOX TRAVELOGUE,20,127.0,10
72130,COLUMBIAN CANDLE ROUND,215,126.79,24
23303,SET 4 PICNIC CUTLERY FONDANT,65,126.75,6
20654,FIRST CLASS LUGGAGE TAG ,105,126.69,23
85067,CREAM SWEETHEART WALL CABINET,7,126.64999999999999,5
85202,HANGING WOOD AND FELT HEART,300,126.0,39
22263,FELT EGG COSY LADYBIRD ,256,125.68,18
90210D,PURPLE ACRYLIC FACETED BANGLE,104,125.0,5
90145,SILVER HOOP EARRINGS WITH FLOWER,21,124.95,11
84510C,SET OF 4 POLKADOT COASTERS,98,124.92,32
85129B,BEADED CRYSTAL HEART GREEN SMALL,101,124.11,16
72799C,PINK PILLAR CANDLE SILVER FLOCK,80,123.68,18
21377,SMALL CAMPHOR WOOD FIELD  MUSHROOM,93,123.20999999999998,19
90058A,CRYSTAL STUD EARRINGS CLEAR DISPLAY,324,123.12,7
85094,CANDY SPOT EGG WARMER RABBIT,502,122.94000000000001,30
20616,CHERRY BLOSSOM PASSPORT COVER,134,122.78,25
85055,FRENCH ENAMEL UTENSIL HOLDER,37,122.75,10
84877D,BLUE ROUND COMPACT MIRROR,88,122.5,11
21027,NINJA RABBIT PINK,101,122.45,17
20735,BLACK MINI TAPE MEASURE ,158,121.3,30
44234,ASSORTED CIRCULAR MOBILE,645,121.04999999999998,19
20845,ZINC HEART LATTICE 2 WALL PLANTER,19,120.64999999999999,11
85131B,BEADED CRYSTAL HEART GREEN ON STICK,142,120.38,13
22104,MIRROR MOSAIC CANDLE PLATE,151,120.07,12
35972,DAISY FOLKART HEART DECORATION,96,120.0,16
20696,FLORAL SOFT CAR TOY,32,120.0,10
23463,VINTAGE ZINC WATERING CAN,12,119.39999999999999,7
85087,CANDY SPOT CUSHION COVER,40,119.36000000000001,7
85135A,YELLOW DRAGONFLY HELICOPTER,15,119.25,6
84709B,PINK OVAL JEWELLED MIRROR,20,119.0,11
84741C,CITRUS GARLAND FELT FLOWERS ,60,117.0,14
21698,MOCK LOBSTER FRIDGE MAGNET,266,116.62,22
23185,FRENCH STYLE STORAGE JAR JAM,323,116.58999999999999,30
72780,BLACK SILOUETTE CANDLE PLATE,137,116.44999999999999,20
51020A,SUMMER FUN DESIGN SHOWER CAP,325,116.32999999999998,18
21826,EIGHT PIECE DINOSAUR SET,93,116.25,18
90210C,RED   ACRYLIC FACETED BANGLE,94,115.9,5
84865,NEW BAROQUE BLACK PHOTO ALBUM,26,115.55,11
21418,STARFISH SOAP DISH,59,115.25,12
22135,LADLE LOVE HEART PINK,262,114.96,48
10080,GROOVY CACTUS INFLATABLE,291,114.41,21
84673B,BLUE FLY SWAT,135,114.21000000000001,42
90191,SILVER LARIAT 40CM,22,113.9,7
90192,JADE DROP EARRINGS W FILIGREE,23,113.85000000000001,8
47518F,ICON PLACEMAT POP ART ELVIS,827,113.64,28
84228,HEN HOUSE W CHICK STANDING,284,113.28,19
85131D,BEADED CRYSTAL HEART PINK ON STICK,115,113.09,12
84925F,PSYCHEDELIC WALL THERMOMETER,80,112.47999999999999,14
84846A,SCENTED CANDLE IN DIGITALIS TIN,53,111.30000000000001,10
84576,BLUE CAT BISCUIT BARREL PINK HEART,57,111.14999999999999,9
22882,NUMBER TILE VINTAGE FONT 3,83,110.28999999999999,20
23496,PANTRY KITCHEN THERMOMETER ,88,110.0,22
21375,LARGE CAMPHOR WOOD FIELD MUSHROOM ,24,109.80000000000001,10
84595E,LARGE TORTILLA DESIGN RED BOWL,64,109.79999999999998,9
21400,RED PUDDING SPOON,837,109.74,48
21278,VINTAGE KITCHEN PRINT PUDDINGS,43,109.64999999999999,7
22877,NUMBER TILE COTTAGE GARDEN 9,56,109.2,13
23578,SNACK TRAY RED GINGHAM,56,109.2,11
35638B,PINK/BLUE STRING CURTAIN ,56,109.2,4
22878,NUMBER TILE COTTAGE GARDEN No,52,109.2,11
20655,QUEEN OF SKIES LUGGAGE TAG,89,109.11,34
21814,HEART T-LIGHT HOLDER ,75,108.75,12
90199C,5 STRAND GLASS NECKLACE CRYSTAL,17,107.94999999999999,7
17090A,LAVENDER INCENSE 40 CONES IN TIN,109,107.44999999999999,10
22872,NUMBER TILE COTTAGE GARDEN 4,55,107.25,13
21904,HOUSE WRECKING METAL SIGN ,51,107.10000000000001,23
21518,BANK ACCOUNT  GREETING  CARD ,265,106.97999999999999,17
23151,ZINC SWEETHEART SOAP DISH,60,106.9,19
23477,WOODLAND LARGE BLUE FELT HEART,85,106.25,8
85215,ASSORTED CHEESE FRIDGE MAGNETS,163,105.95000000000002,8
20775,DAISY NOTEBOOK ,64,105.6,20
22868,NUMBER TILE COTTAGE GARDEN 0 ,54,105.3,10
22874,NUMBER TILE COTTAGE GARDEN 6,54,105.3,11
16052,TEATIME PUSH DOWN RUBBER,467,105.28999999999999,6
84748,FOLK FELT HANGING MULTICOL GARLAND,28,105.0,8
22039,BOTANICAL LILY GIFT WRAP,250,105.0,7
23574,PACKING CHARGE,14,105.0,14
84461,12 PINK HEN+CHICKS IN BASKET,41,104.55,14
90014A,SILVER/MOP ORBIT NECKLACE,16,103.19999999999999,10
21157,RED RETROSPOT WASHBAG,49,102.9,14
22885,NUMBER TILE VINTAGE FONT 6 ,79,102.49,12
22881,NUMBER TILE VINTAGE FONT 2,79,102.49,13
21366,MIRRORED WALL ART PHOTO FRAMES,24,102.0,10
84457,SET/3 RABBITS FLOWER SKIPPPING ROPE,120,102.0,21
90148,LONG SILVER NECKLACE PASTEL FLOWER,8,102.0,5
90196A,PURPLE GEMSTONE NECKLACE 45CM,8,102.0,5
35819B,"ACRYLIC HANGING JEWEL,BLUE",268,101.84,22
22871,NUMBER TILE COTTAGE GARDEN 3 ,52,101.39999999999999,10
22876,NUMBER TILE COTTAGE GARDEN 8,52,101.39999999999999,11
47594A,CAROUSEL DESIGN WASHBAG,52,101.39999999999999,26
84509E,SET OF 4 CAROUSEL PLACEMATS ,70,101.06,8
16033,MINI HIGHLIGHTER PENS,840,100.79999999999998,4
20796,SMALL BLUE PROVENCAL CERAMIC BALL,61,100.64999999999999,8
22883,NUMBER TILE VINTAGE FONT 4,78,100.53999999999999,11
35818P,"ACRYLIC JEWEL ICICLE, PINK",264,100.32000000000001,17
85129C,BEADED CRYSTAL HEART BLUE SMALL,77,99.88,12
22875,NUMBER TILE COTTAGE GARDEN 7,51,99.45,14
17091A,LAVENDER INCENSE IN TIN,172,99.29,25
84906,PINK B'FLY C/COVER W BOBBLES,28,98.6,10
90184C,BLACK CHUNKY BEAD BRACELET W STRAP,11,98.44999999999999,7
22407,MONEY BOX FIRST ADE DESIGN,94,98.07,23
84723,CHERRY BLOSSOM CANVAS ART PICTURE,41,97.95,6
84806A,PINK CANDYSTUFT ARTIFICIAL FLOWER,137,96.88999999999999,11
84801A,PINK HYDRANGEA ART FLOWER,46,96.60000000000001,5
79190D,RETRO PLASTIC DAISY TRAY,227,95.34,25
90195A,PURPLE GEMSTONE BRACELET,16,95.2,7
84569B,PACK 3 FIRE ENGINE/CAR PATCHES,76,95.0,11
84666,SQUARE CHERRY BLOSSOM CABINET,24,94.80000000000001,4
22884,NUMBER TILE VINTAGE FONT 5,75,94.69,16
84898F,YELLOW FLOWERS FELT HANDBAG KIT,45,94.50000000000001,18
46776F,WOVEN ROSE GARDEN CUSHION COVER ,19,94.05000000000001,8
90125A,PINK BERTIE GLASS BEAD BAG CHARM,109,93.89999999999999,6
90063A,WHITE VINT ART DECO CRYSTAL NECKLAC,11,93.5,7
90185A,AMBER DIAMANTE EXPANDABLE RING,22,93.5,5
85167B,BLACK GRAND BAROQUE PHOTO FRAME,48,93.0,7
22886,NUMBER TILE VINTAGE FONT 7,74,92.74,13
20731,POSY CANDY BAG,74,92.5,8
20795,LARGE BLUE PROVENCAL CERAMIC BALL,44,92.4,8
20773,BLUE PAISLEY NOTEBOOK,56,92.39999999999999,23
47503H,ASS FLORAL PRINT SPIRIT LEVEL ,96,92.08,32
82615,PINK MARSHMALLOW SCARF KNITTING KIT,36,91.8,1
22873,NUMBER TILE COTTAGE GARDEN 5,47,91.64999999999999,13
90032,IVORY SHELL HEART NECKLACE,19,90.67,6
85230F,JASMINE VOTIVE CANDLE,338,90.33999999999999,12
21690,SILVER  CANDLEPOT JARDIN ,24,90.0,7
37343,POLKADOT MUG PINK ,62,89.69999999999999,8
85179C,PINK BITTY LIGHT CHAIN,69,89.65,7
90010E,AMBER GLASS/SILVER BRACELET,10,89.5,7
35400,WOODEN BOX ADVENT CALENDAR ,10,89.5,5
90185C,BLACK DIAMANTE EXPANDABLE RING,21,89.25,5
21281,VINTAGE KITCHEN PRINT SEAFOOD,35,89.24999999999999,6
90019A,SILVER M.O.P ORBIT BRACELET,18,89.10000000000001,9
22880,NUMBER TILE VINTAGE FONT 1,72,88.84,11
21678,PAISLEY PATTERN  STICKERS,104,88.39999999999999,16
84984A,GREEN PEONY CUSHION COVER,19,88.35000000000001,6
21370,MIRRORED WALL ART FOXY,15,88.2,8
90036D,"FLOWER GLASS GARLAND NECKL.36""BLACK",11,87.45,4
23442,12 HANGING EGGS HAND PAINTED,42,87.36,7
90180A,BLACK+WHITE NECKLACE W TASSEL,13,87.35,5
21420,OYSTER TRINKET BOX,48,87.12,13
21038,SET/4 MODERN VINTAGE COTTON NAPKINS,77,86.75,23
20774,GREEN FERN NOTEBOOK,52,85.8,22
90014B,GOLD M PEARL  ORBIT NECKLACE,10,85.5,8
75172,PAINTED SEA SHELL METAL WINDCHIME,93,85.31,8
90200C,BLUE SWEETHEART BRACELET,20,85.0,6
90120B,BLUE MURANO TWIST BRACELET,20,85.0,5
21032,SPACE CADET WHITE,65,84.88,15
84527,FLAMES SUNGLASSES PINK LENSES,47,84.44999999999999,6
35933,PINK STOCKING CHRISTMAS DECORATION,222,84.36,16
90122C,TURQUOISE CRYSTAL+GLASS BRACELET,17,84.15,5
16169K,WRAP FOLK ART,200,84.0,8
82613A,"METAL SIGN,CUPCAKE SINGLE HOOK",67,83.75,14
35920,FOUR RABBIT EASTER DECORATIONS,67,83.75,11
84531B,BLUE KNITTED EGG COSY,150,83.46,25
90123A,PINK HEART OF GLASS BRACELET,14,83.3,8
21003,ROSE DU SUD CUSHION COVER,13,82.55,6
35638A,PINK AND BLACK STRING CURTAIN,38,82.1,5
16049,TEATIME GEL PENS ASST,504,82.08,5
21349,IVY HEART WREATH,12,81.0,7
35915C,PEACH KNITTED HEN ,49,80.85,8
90016A,SILVER/M.O.P PENDANT ORBIT NECKLACE,14,80.75,4
21095,SET/6 POSIES PAPER PLATES,95,80.75,9
90175C,BLUE GLASS CHUNKY CHARM BRACELET,9,80.55,6
90175A,WHITE GLASS CHUNKY CHARM BRACELET,9,80.55,8
84809A,WHITE CHRYSANTHEMUMS ART FLOWER,38,79.80000000000001,5
90162B,ANT SILVER LIME GREEN BOUDICCA RING,27,79.65,10
20821,GOLDIE LOOKING MIRROR,16,79.2,5
23464,VINTAGE ZINC WATERING CAN SMALL,16,79.2,6
84984B,RED PEONY CUSHION COVER ,17,79.05000000000001,5
84507B,STRIPES DESIGN MONKEY DOLL,31,79.05,14
84685,BEACH HUT KEY CABINET,21,78.75,9
84847,FLORAL BATHROOM SET,21,78.75,11
85131C,BEADED CRYSTAL HEART BLUE ON STICK,73,78.71,11
90123C,GREEN HEART OF GLASS BRACELET,13,77.35,5
22887,NUMBER TILE VINTAGE FONT 8,66,77.14,11
90016B,GOLD/M.O.P PENDANT ORBIT NECKLACE,9,76.5,8
20657,TROPICAL LUGGAGE TAG,61,76.39,22
20941,FROG CANDLE,61,76.25,17
90170,DAISY HAIR BAND,46,75.89999999999999,6
21372,MIRRORED WALL ART TABLE LAMP,67,75.73,25
23467,VINTAGE ZINC PLANTER  ,23,75.67,5
79403,FROSTED WHITE BASE ,89,75.64999999999999,11
20798,CLEAR MILKSHAKE GLASS,36,75.60000000000001,5
84870B,BLUE GEISHA GIRL ,20,75.0,10
85096,HILDA CANDY SPOT RABBIT,20,75.0,11
84870C,GREEN GEISHA GIRL ,20,75.0,10
22764,"RUSTIC WOODEN CABINET, GLASS DOORS",3,74.85,2
90081A,LILY BROOCH AMETHYST COLOUR,15,74.25,8
46776B,WOVEN BERRIES CUSHION COVER ,15,74.25,7
20997,ROSE DU SUD CUSHION COVER ,15,74.25,5
90030C,BROWN KUKUI COCONUT SEED NECKLACE,74,74.0,8
20699,MOUSEY LONG LEGS SOFT TOY,29,73.94999999999999,11
20898,VINTAGE NOTEBOOK TRAVELOGUE,25,73.75,4
20894,HANGING BAUBLE T-LIGHT HOLDER LARGE,25,73.75,9
17084P,DRAGONS BLOOD INCENSE,349,73.29,13
72801D,4 SKY BLUE DINNER CANDLES,58,72.5,12
90018A,SILVER M.O.P ORBIT DROP EARRINGS,17,72.25,9
46000P,POLYESTER FILLER PAD 65CMx65CM,17,72.25,5
90030A,SPOTTED WHITE NATURAL SEED NECKLACE,72,72.0,7
84927E,FLOWERS TILE HOOK,57,71.82000000000001,11
84531A,PINK KNITTED EGG COSY,140,71.75999999999999,25
90178A,AMBER CHUNKY GLASS+BEAD NECKLACE,6,71.69999999999999,6
90184A,AMBER CHUNKY BEAD BRACELET W STRAP,8,71.6,4
90098,NECKLACE+BRACELET PINK BUTTERFLY,28,71.39999999999999,9
22888,NUMBER TILE VINTAGE FONT 9 ,63,71.28999999999999,8
20933,YELLOW POT PLANT CANDLE,23,71.05,9
21100,CHARLIE AND LOLA CHARLOTTE BAG,43,70.95,8
47589,CONGRATULATIONS BUNTING,13,70.85000000000001,3
51020B,STRIPY DESIGN SHOWER CAP,197,70.57,15
90164A,PINK ROSEBUD PEARL BRACELET,19,70.35,6
84661C,PINK SQUARE TABLE CLOCK,62,70.10000000000001,5
16161G,WRAP BAD HAIR DAY,700,70.0,22
84881,BLUE WIRE SPIRAL CANDLE HOLDER,11,69.85,5
81952V,ROUND PURPLE CLOCK WITH SUCKER,367,69.73,24
90124C,GREEN MURANO TWIST NECKLACE,7,69.64999999999999,4
22879,NUMBER TILE VINTAGE FONT 0,62,69.34,8
90158,ST TROPEZ NECKLACE,14,69.30000000000001,6
46776A,WOVEN BUBBLE GUM CUSHION COVER,14,69.30000000000001,6
85197,SET OF 12 MINI BUNNIES IN A BUCKET,33,69.30000000000001,18
46776E,WOVEN CANDY CUSHION COVER ,14,69.3,5
84249A,"GREETING CARD,SQUARE, DOUGHNUTS",160,68.84,13
72801G,4 BURGUNDY WINE DINNER CANDLES,55,68.75,11
84231,EASTER BUNNY WITH BASKET ON BACK,105,68.25,18
85198,ASSORTED FARMYARD ANIMALS IN BUCKET,86,68.06,6
90151,SILVER/NATURAL SHELL NECKLACE,8,68.0,4
90063B,BLACK VINT ART DEC CRYSTAL NECKLACE,8,68.0,5
22184,CAKE STAND VICTORIAN FILIGREE LARGE,8,68.0,4
84247K,"FOLK ART GREETING CARD,pack/12",23,67.85000000000001,9
17014A,ORIGAMI VANILLA INCENSE CONES,154,67.83,7
35921,EASTER BUNNY HANGING GARLAND,54,67.5,11
85049B,LUSH GREENS RIBBONS,54,67.5,13
90003D,CRYSTAL PAIR HEART HAIR SLIDES,18,67.5,7
72811,SMALL ZINC/GLASS CANDLEHOLDER,49,67.25,6
90108,BLUE BLOSSOM HAIR CLIP,64,67.2,6
35819P,"ACRYLIC HANGING JEWEL,PINK",95,66.55,7
84686,BEACH HUT MIRROR,49,66.39,8
90164B,WHITE  ROSEBUD PEARL BRACELET,28,65.7,7
90000A,RASPBERRY ANT COPPER FLOWER NECKLAC,11,65.45,6
90125D,PURPLE BERTIE GLASS BEAD BAG CHARM,74,65.39999999999999,5
84247N,PACK/12 BLUE FOLKART CARDS,22,64.9,18
90206C,CRYSTAL DIAMANTE STAR BROOCH,13,64.35000000000001,7
90073,VINTAGE ENAMEL & CRYSTAL EARRINGS,13,64.35000000000001,4
85026B,EAU DE NILE JEWELLED T-LIGHT HOLDER,75,63.75,9
21692,SILVER LATTICE VANILLA CANDLE POT,17,63.75,7
