StockCode,Description,TotalQuantity,TotalRevenue,OrderCount
23843,"PAPER CRAFT , LITTLE BIRDIE",80995,168469.6,1
22423,REGENCY CAKESTAND 3 TIER,12402,142592.94999999998,1703
85123A,WHITE HANGING HEART T-LIGHT HOLDER,36782,100603.5,1978
85099B,JUMBO BAG RED RETROSPOT,46181,85220.78,1600
23166,MEDIUM CERAMIC TOP STORAGE JAR,77916,81416.73000000001,195
POST,POSTAGE,3120,77803.96,1099
47566,PARTY BUNTING,15291,68844.33,1379
84879,ASSORTED COLOUR BIRD ORNAMENT,35362,56580.34,1375
M,Manual,7173,53779.93,253
23084,RABBIT NIGHT LIGHT,27202,51346.2,801
22502,PICNIC BASKET WICKER SMALL,1488,47366.2,234
79321,CHILLI LIGHTS,9650,46286.51,519
22086,PAPER CHAIN KIT 50'S CHRISTMAS ,15617,42660.83,980
21137,BLACK RECORD COVER FRAME,11406,39064.55,313
23203,JUMBO BAG DOILEY PATTERNS,19516,37684.38,1080
22386,JUMBO BAG PINK POLKADOT,20165,37289.590000000004,871
22197,SMALL POPCORN HOLDER,49183,37226.43,1035
23298,SPOTTY BUNTING,7785,36173.950000000004,1009
23284,DOORMAT KEEP CALM AND COME IN,5342,35913.85,648
82484,WOOD BLACK BOARD ANT WHITE FINISH,5921,34478.01,604
22720,SET OF 3 CAKE TINS PANTRY DESIGN ,7020,33347.8,1146
22960,JAM MAKING SET WITH JARS,8151,32662.97,878
85099F,JUMBO BAG STRAWBERRY,16807,30644.2,654
22178,VICTORIAN GLASS HANGING T-LIGHT,22433,28776.51,815
22470,HEART OF WICKER LARGE,9591,28520.95,801
20725,LUNCH BAG RED RETROSPOT,17897,28338.45,1289
22469,HEART OF WICKER SMALL,16775,28228.64,961
23245,SET OF 3 REGENCY CAKE TINS,5856,26625.68,718
23199,JUMBO BAG APPLES,13887,26451.260000000002,718
21175,GIN + TONIC DIET METAL SIGN,11993,26107.44,692
22727,ALARM CLOCK BAKELIKE RED ,7221,25925.2,877
22910,PAPER CHAIN KIT VINTAGE CHRISTMAS,9433,25669.27,697
20685,DOORMAT RED RETROSPOT,3901,25397.85,576
22699,ROSES REGENCY TEACUP AND SAUCER ,9132,24865.600000000002,783
22629,SPACEBOY LUNCH BOX ,13919,24694.59,704
23355,HOT WATER BOTTLE KEEP CALM,5338,24426.300000000003,719
22457,NATURAL SLATE HEART CHALKBOARD ,8480,24245.52,967
23201,JUMBO BAG ALPHABET,12540,24175.0,752
21181,PLEASE ONE PERSON METAL SIGN,11963,23930.920000000002,694
21915,RED  HARMONICA IN BOX ,20975,23793.93,561
48138,DOORMAT UNION FLAG,3625,23697.99,516
85099C,JUMBO  BAG BAROQUE BLACK WHITE,12793,23675.04,649
22112,CHOCOLATE HOT WATER BOTTLE,5160,23624.24,700
23173,REGENCY TEAPOT ROSES ,2666,23073.32,354
22138,BAKING SET 9 PIECE RETROSPOT ,4797,23007.55,854
48187,DOORMAT NEW ENGLAND,3721,22968.25,531
22189,CREAM HEART CARD HOLDER,8195,22715.57,452
21623,VINTAGE UNION JACK MEMOBOARD,3255,22709.13,205
21733,RED HANGING HEART T-LIGHT HOLDER,7759,22624.690000000002,679
22326,ROUND SNACK BOXES SET OF4 WOODLAND ,8100,22175.52,595
23243,SET OF TEA COFFEE SUGAR TINS PANTRY,4663,22133.83,385
21931,JUMBO STORAGE BAG SUKI,11516,21790.95,774
48185,DOORMAT FAIRY CAKE,3429,21187.69,241
22961,JAM MAKING SET PRINTED,15055,21170.75,868
23202,JUMBO BAG VINTAGE LEAF,10716,20963.93,772
21621,VINTAGE UNION JACK BUNTING,2540,20962.16,391
22726,ALARM CLOCK BAKELIKE GREEN,5641,20880.4,789
22666,RECIPE BOX PANTRY YELLOW DESIGN,7373,20859.27,828
23209,LUNCH BAG DOILEY PATTERN ,13004,20817.56,1006
15056N,EDWARDIAN PARASOL NATURAL,3826,20696.71,378
85066,CREAM SWEETHEART MINI CHEST,1705,20562.92,445
22722,SET OF 6 SPICE TINS PANTRY DESIGN,5372,20530.0,653
22139,RETROSPOT TEA SET CERAMIC 11 PC ,4248,20470.780000000002,823
21166,COOK WITH WINE METAL SIGN ,10209,20315.33,602
22411,JUMBO SHOPPER VINTAGE RED PAISLEY,10518,20174.23,790
22630,DOLLY GIRL LUNCH BOX,11336,20129.44,616
22111,SCOTTIE DOG HOT WATER BOTTLE,4259,20104.350000000002,656
71477,COLOUR GLASS. STAR T-LIGHT HOLDER,6652,20049.12,263
82482,WOODEN PICTURE FRAME WHITE FINISH,8276,20001.65,876
48194,DOORMAT HEARTS,3271,19948.81,480
21731,RED TOADSTOOL LED NIGHT LIGHT,12871,19844.91,522
22659,LUNCH BOX I LOVE LONDON,11094,19353.219999999998,504
84946,ANTIQUE SILVER TEA GLASS ETCHED,16473,19239.420000000002,677
21523,DOORMAT FANCY FONT HOME SWEET HOME,3088,19157.02,397
20713,JUMBO BAG OWLS,10466,19076.92,411
84997D,PINK 3 PIECE POLKADOT CUTLERY SET,4922,18807.0,424
22090,PAPER BUNTING RETROSPOT,6879,18791.890000000003,567
22383,LUNCH BAG SUKI  DESIGN ,11722,18723.7,1043
22728,ALARM CLOCK BAKELIKE PINK,5074,18569.09,613
21929,JUMBO BAG PINK VINTAGE PAISLEY,9889,18429.98,602
23206,LUNCH BAG APPLE DESIGN,11565,18278.25,866
21928,JUMBO BAG SCANDINAVIAN PAISLEY,9704,18063.62,542
20727,LUNCH BAG  BLACK SKULL.,11291,18024.55,1052
21843,RED RETROSPOT CAKE STAND,1809,17929.75,421
22697,GREEN REGENCY TEACUP AND SAUCER,6430,17806.34,691
23344,JUMBO BAG 50'S CHRISTMAS ,8954,17679.72,586
82494L,WOODEN FRAME ANTIQUE WHITE ,6282,17625.07,811
22328,ROUND SNACK BOXES SET OF 4 FRUITS ,6481,17604.99,458
84347,ROTATING SILVER ANGELS T-LIGHT HLDR,7907,17592.52,305
82486,WOOD S/3 CABINET ANT WHITE FINISH,2085,17590.63,559
22467,GUMBALL COAT RACK,7688,17580.350000000002,570
22969,HOMEMADE JAM SCENTED CANDLES,12092,17521.6,518
21108,FAIRY CAKE FLANNEL ASSORTED COLOUR,10082,17304.57,192
20914,SET/5 RED RETROSPOT LID GLASS BOWLS,6170,17303.98,764
20728,LUNCH BAG CARS BLUE,10820,17265.68,966
22693,GROW A FLYTRAP OR SUNFLOWER IN TIN,15940,17226.2,239
23240,SET OF 4 KNICK KNACK TINS DOILEY ,4103,16432.25,485
21212,PACK OF 72 RETROSPOT CAKE CASES,33693,16394.53,1029
22384,LUNCH BAG PINK POLKADOT,10254,16349.5,931
22865,HAND WARMER OWL DESIGN,8115,16237.630000000001,572
15036,ASSORTED COLOURS SILK FAN,21876,16044.44,324
22492,MINI PAINT SET VINTAGE ,26076,16039.240000000002,325
22382,LUNCH BAG SPACEBOY DESIGN ,9912,15881.199999999999,988
21485,RETROSPOT HEART HOT WATER BOTTLE,3335,15871.73,533
21754,HOME BUILDING BLOCK WORD,2654,15630.960000000001,691
85152,HAND OVER THE CHOCOLATE   SIGN ,8164,15539.11,590
20712,JUMBO BAG WOODLAND ANIMALS,8187,15511.6,492
22114,HOT WATER BOTTLE TEA AND SYMPATHY,3736,15415.22,514
22385,JUMBO BAG SPACEBOY DESIGN,8236,15331.02,477
15056BL,EDWARDIAN PARASOL BLACK,2779,15218.67,291
84997B,RED 3 PIECE RETROSPOT CUTLERY SET,4035,15158.81,326
22077,6 RIBBONS RUSTIC CHARM,8605,14988.589999999998,726
22624,IVORY KITCHEN SCALES,1783,14788.33,620
22698,PINK REGENCY TEACUP AND SAUCER,5343,14769.49,556
82483,WOOD 2 DRAWER CABINET WHITE FINISH,2341,14689.87,509
20726,LUNCH BAG WOODLAND,9115,14537.11,820
22993,SET OF 4 PANTRY JELLY MOULDS,11792,14180.17,866
84997C,BLUE 3 PIECE POLKADOT CUTLERY SET,3694,14044.74,308
22835,HOT WATER BOTTLE I AM SO POORLY,2972,13847.28,505
84077,WORLD WAR 2 GLIDERS ASSTD DESIGNS,54415,13586.249999999998,472
48184,DOORMAT ENGLISH ROSE ,1975,13470.95,356
22084,PAPER CHAIN KIT EMPIRE,4893,13435.150000000001,374
84029E,RED WOOLLY HOTTIE WHITE HEART.,3707,13430.51,321
22847,BREAD BIN DINER STYLE IVORY,851,13191.689999999999,342
23356,LOVE HOT WATER BOTTLE,2352,13115.400000000001,449
22900, SET 2 TEA TOWELS I LOVE LONDON ,4580,13068.2,368
23200,JUMBO BAG PEARS,6733,13043.24,470
22622,BOX OF VINTAGE ALPHABET BLOCKS,1295,13035.66,231
84078A,SET/4 WHITE RETRO STORAGE CUBES ,357,13007.150000000001,106
23313,VINTAGE CHRISTMAS BUNTING,2755,12994.77,359
23108,SET OF 10 LED DOLLY LIGHTS,2194,12985.23,351
82583,HOT BATHS METAL SIGN,6415,12832.140000000001,385
84978,HANGING HEART JAR T-LIGHT HOLDER,10980,12674.720000000001,572
22752,SET 7 BABUSHKA NESTING BOXES,1654,12665.29,297
22558,CLOTHES PEGS RETROSPOT PACK 24 ,8418,12545.38,639
23301,GARDENERS KNEELING PAD KEEP CALM ,7740,12493.48,756
22507,MEMO BOARD RETROSPOT  DESIGN,2786,12411.02,348
22171,3 HOOK PHOTO SHELF ANTIQUE WHITE,1723,12294.380000000001,304
22188,BLACK HEART CARD HOLDER,4844,12261.9,166
22866,HAND WARMER SCOTTY DOG DESIGN,6118,12248.760000000002,471
20750,RED RETROSPOT MINI CASES,1712,12216.8,365
21232,STRAWBERRY CERAMIC TRINKET BOX,10366,12210.06,582
22113,GREY HEART HOT WATER BOTTLE,3156,12191.15,511
22551,PLASTERS IN TIN SPACEBOY,7664,12151.8,579
22941,CHRISTMAS LIGHTS 10 REINDEER,1572,12150.0,253
20749,ASSORTED COLOUR MINI CASES,1719,12123.41,365
82600,NO SINGING METAL SIGN,5833,12097.380000000001,419
21524,DOORMAT SPOTTY HOME SWEET HOME,1662,12095.67,405
22867,HAND WARMER BIRD DESIGN,6001,12081.430000000002,474
22083,PAPER CHAIN KIT RETROSPOT,4307,12043.210000000001,444
23207,LUNCH BAG ALPHABET DESIGN,7554,12029.06,647
22379,RECYCLING BAG RETROSPOT ,6088,11942.43,407
DOT,DOTCOM POSTAGE,16,11906.36,16
22625,RED KITCHEN SCALES,1476,11895.73,448
22568,FELTCRAFT CUSHION OWL,3284,11783.05,417
22273,FELTCRAFT DOLL MOLLY,4469,11762.99,293
47590B,PINK HAPPY BIRTHDAY BUNTING,2287,11688.150000000001,359
23077,DOUGHNUT LIP GLOSS ,9662,11640.7,308
22554,PLASTERS IN TIN WOODLAND ANIMALS,7307,11637.429999999998,587
21977,PACK OF 60 PINK PAISLEY CAKE CASES,24264,11629.7,669
20971,PINK BLUE FELT CRAFT TRINKET BOX,10225,11629.39,457
22607,WOODEN ROUNDERS GARDEN SET ,1269,11601.14,303
22191,IVORY DINER WALL CLOCK,1426,11587.2,391
23174,REGENCY SUGAR BOWL GREEN,2956,11575.54,268
22149,FELTCRAFT 6 FLOWER FRIENDS,5890,11566.390000000001,461
48188,DOORMAT WELCOME PUPPIES,2028,11544.2,252
21755,LOVE BUILDING BLOCK WORD,1946,11535.560000000001,555
22427,ENAMEL FLOWER JUG CREAM,1995,11444.93,441
22193,RED DINER WALL CLOCK,1352,11074.390000000001,416
21930,JUMBO STORAGE BAG SKULLS,5706,10890.79,471
22501,PICNIC BASKET WICKER LARGE,1194,10818.9,257
22570,FELTCRAFT CUSHION RABBIT,3018,10694.81,324
22413,METAL SIGN TAKE IT OR LEAVE IT ,3690,10647.300000000001,351
22776,SWEETHEART CAKESTAND 3 TIER,1116,10570.6,449
21790,VINTAGE SNAP CARDS,13336,10447.42,722
47566B,TEA TIME PARTY BUNTING,2291,10445.25,313
21936,RED RETROSPOT PICNIC BAG,3758,10371.66,385
22662,LUNCH BAG DOLLY GIRL DESIGN,6545,10360.69,598
22730,ALARM CLOCK BAKELIKE IVORY,2728,10285.61,468
22087,PAPER BUNTING WHITE LACE,3779,10264.050000000001,257
85014B,RED RETROSPOT UMBRELLA,1846,10247.470000000001,303
21479,WHITE SKULL HOT WATER BOTTLE ,2702,10227.72,378
22617,BAKING SET SPACEBOY DESIGN,2153,10210.890000000001,424
23170,REGENCY TEA PLATE ROSES ,6575,10190.789999999999,328
21340,CLASSIC METAL BIRDCAGE PLANT HOLDER,928,10161.41,260
22988,SOLDIERS EGG CUP ,8821,10150.220000000001,327
20724,RED RETROSPOT CHARLOTTE BAG,12809,10125.85,739
47590A,BLUE HAPPY BIRTHDAY BUNTING,1950,10107.52,355
71459,HANGING JAM JAR T-LIGHT HOLDER,12941,10031.45,379
21891,TRADITIONAL WOODEN SKIPPING ROPE,7919,10019.47,340
23208,LUNCH BAG VINTAGE LEAF DESIGN,6225,10006.45,597
23300,GARDENERS KNEELING PAD CUP OF TEA ,6303,9963.39,635
22499,WOODEN UNION JACK BUNTING,1734,9928.83,296
48173C,DOORMAT BLACK FLOCK ,1787,9822.2,173
23343,JUMBO BAG VINTAGE CHRISTMAS ,4908,9748.34,385
23076,ICE CREAM SUNDAE LIP GLOSS,7920,9668.16,248
22970,LONDON BUS COFFEE MUG,4246,9666.3,276
21080,SET/20 RED RETROSPOT PAPER NAPKINS ,12313,9656.789999999999,732
22569,FELTCRAFT CUSHION BUTTERFLY,2698,9655.48,294
22690,DOORMAT HOME SWEET HOME BLUE ,1597,9635.89,261
84997A,GREEN 3 PIECE POLKADOT CUTLERY SET,2525,9618.29,234
84755,COLOUR GLASS T-LIGHT HOLDER HANGING,15611,9597.710000000001,529
22846,BREAD BIN DINER STYLE RED ,626,9597.31,249
22556,PLASTERS IN TIN CIRCUS PARADE ,5952,9596.96,521
22605,WOODEN CROQUET GARDEN SET,709,9555.98,240
22633,HAND WARMER UNION JACK,4746,9550.560000000001,441
22692,DOORMAT WELCOME TO OUR HOME,1378,9468.08,338
22555,PLASTERS IN TIN STRONGMAN,5885,9462.289999999999,449
21430,SET/3 RED GINGHAM ROSE STORAGE BOX,2704,9424.32,319
85048,15CM CHRISTMAS GLASS BALL 20 LIGHTS,1266,9374.7,214
22766,PHOTO FRAME CORNICE,3206,9365.78,454
84947,ANTIQUE SILVER TEA GLASS ENGRAVED,8273,9339.34,278
84029G,KNITTED UNION FLAG HOT WATER BOTTLE,2469,9329.17,319
22560,TRADITIONAL MODELLING CLAY,8014,9311.47,336
22621,TRADITIONAL KNITTING NANCY,5895,9297.869999999999,509
21914,BLUE HARMONICA IN BOX ,7434,9222.63,517
21481,FAWN BLUE HOT WATER BOTTLE,2925,9218.550000000001,379
21217,RED RETROSPOT ROUND CAKE TINS,975,9188.25,257
23171,REGENCY TEA PLATE GREEN ,5966,9184.9,270
22978,PANTRY ROLLING PIN,2407,9184.279999999999,197
22561,WOODEN SCHOOL COLOURING SET,5695,9072.869999999999,395
20679,EDWARDIAN PARASOL RED,1630,9055.87,270
23175,REGENCY MILK JUG PINK ,3066,9008.0,272
22992,REVOLVER WOODEN RULER ,4917,8950.289999999999,285
22632,HAND WARMER RED POLKA DOT,4394,8751.12,359
22838,3 TIER CAKE TIN RED AND CREAM,652,8737.78,136
21559,STRAWBERRY LUNCH BOX WITH CUTLERY,3716,8734.64,426
85150,LADIES & GENTLEMEN METAL SIGN,3899,8699.13,367
84375,SET OF 20 KIDS COOKIE CUTTERS,4149,8697.27,416
20972,PINK CREAM FELT CRAFT TRINKET BOX ,7131,8648.49,535
22966,GINGERBREAD MAN COOKIE CUTTER,7204,8625.130000000001,554
84991,60 TEATIME FAIRY CAKE CASES,17689,8618.37,657
22619,SET OF 6 SOLDIER SKITTLES,2297,8597.5,339
82582,AREA PATROLLED METAL SIGN,4290,8552.220000000001,374
23582,VINTAGE DOILY JUMBO BAG RED ,4447,8535.26,234
21791,VINTAGE HEADS AND TAILS CARD GAME ,7143,8531.41,485
23581,JUMBO BAG PAISLEY PARK,4373,8529.24,302
22424,ENAMEL BREAD BIN CREAM,713,8519.0,326
22041,"RECORD FRAME 7"" SINGLE SIZE ",3812,8450.82,196
22169,FAMILY ALBUM WHITE PICTURE FRAME,1075,8416.64,286
22791,T-LIGHT GLASS FLUTED ANTIQUE,7336,8378.890000000001,260
21174,POTTERING IN THE SHED METAL SIGN,3926,8372.7,371
21216,"SET 3 RETROSPOT TEA,COFFEE,SUGAR",1841,8354.87,241
23318,BOX OF 6 MINI VINTAGE CRACKERS,3647,8350.41,329
22989,SET 2 PANTRY DESIGN TEA TOWELS,2697,8323.17,311
22147,FELTCRAFT BUTTERFLY HEARTS,6127,8314.55,436
22759,SET OF 3 NOTEBOOKS IN PARCEL,5207,8283.75,319
84945,MULTI COLOUR SILVER T-LIGHT HOLDER,10279,8269.45,306
23319,BOX OF 6 MINI 50'S CRACKERS,3539,8216.79,365
23322,LARGE WHITE HEART OF WICKER,2908,8184.700000000001,511
22158,3 HEARTS HANGING DECORATION RUSTIC,2895,8161.21,261
23082,SET 6 PAPER TABLE LANTERN HEARTS ,2265,8129.43,263
22655,VINTAGE RED KITCHEN CABINET,60,8125.0,38
23256,CHILDRENS CUTLERY SPACEBOY ,2018,8123.780000000001,324
23078,ICE CREAM PEN LIP GLOSS ,6607,8077.31,213
22749,FELTCRAFT PRINCESS CHARLOTTE DOLL,2223,8071.51,401
48116,DOORMAT MULTICOLOUR STRIPE,1419,8053.22,141
22734,SET OF 6 RIBBONS VINTAGE CHRISTMAS,2843,8051.83,329
22729,ALARM CLOCK BAKELIKE ORANGE,2182,7995.63,359
23080,RED METAL BOX TOP SECRET,1003,7962.03,221
22667,RECIPE BOX RETROSPOT ,2870,7952.900000000001,441
21210,SET OF 72 RETROSPOT PAPER  DOILIES,5680,7947.37,365
21121,SET/10 RED POLKADOT PARTY CANDLES,6502,7799.18,336
22652,TRAVEL SEWING KIT,4864,7787.36,394
72741,GRAND CHOCOLATECANDLE,5801,7785.049999999999,249
84378,SET OF 3 HEART COOKIE CUTTERS,6019,7741.84,521
22940,FELTCRAFT CHRISTMAS FAIRY,1896,7722.68,302
20711,JUMBO BAG TOYS ,4198,7689.28,245
35970,ZINC FOLKART SLEIGH BELLS,4647,7665.110000000001,339
23439,HAND WARMER RED LOVE HEART,3762,7660.200000000001,371
22768,FAMILY PHOTO FRAME CORNICE,837,7646.839999999999,233
22192,BLUE DINER WALL CLOCK,907,7528.93,338
23328,SET 6 SCHOOL MILK BOTTLES IN CRATE,2067,7510.29,281
21136,PAINTED METAL PEARS ASSORTED,4476,7491.4,352
22952,60 CAKE CASES VINTAGE CHRISTMAS,14759,7431.05,467
21314,SMALL GLASS HEART TRINKET POT,3670,7412.56,342
22557,PLASTERS IN TIN VINTAGE PAISLEY ,4573,7346.69,480
21770,OPEN CLOSED METAL SIGN,1577,7311.360000000001,341
20719,WOODLAND CHARLOTTE BAG,9237,7277.24,531
22616,PACK OF 12 LONDON TISSUES ,25345,7266.71,382
22804,CANDLEHOLDER PINK HANGING HEART,2869,7247.910000000001,409
21889,WOODEN BOX OF DOMINOES,5778,7215.95,449
21908,CHOCOLATE THIS WAY METAL SIGN,3635,7208.52,374
84949,SILVER HANGING T-LIGHT HOLDER,4665,7193.249999999999,250
23238,SET OF 4 KNICK KNACK TINS LONDON ,1788,7170.6,233
22750,FELTCRAFT PRINCESS LOLA DOLL,1964,7166.94,378
22585,PACK OF 6 BIRDY GIFT TAGS,6062,7149.7,319
22355,CHARLOTTE BAG SUKI DESIGN,8975,7138.65,585
22144,CHRISTMAS CRAFT LITTLE FRIENDS,3468,7128.1,421
84406B,CREAM CUPID HEARTS COAT HANGER,1918,7125.38,241
84836,ZINC METAL HEART DECORATION,5757,7108.68,476
22795,SWEETHEART RECIPE BOOK STAND,1099,7084.650000000001,287
21218,RED SPOTTY BISCUIT TIN,2058,7071.2,203
23007, SPACEBOY BABY GIFT SET,450,7065.499999999999,142
22950,36 DOILIES VINTAGE CHRISTMAS,5180,7045.4,166
22741,FUNKY DIVA PEN,8328,7010.94,155
21787,RAIN PONCHO RETROSPOT,8755,6964.63,180
23215,JINGLE BELL HEART ANTIQUE SILVER,3547,6962.04,197
22767,TRIPLE PHOTO FRAME CORNICE ,761,6932.83,208
23320,GIANT 50'S CHRISTMAS CRACKER,2635,6926.110000000001,310
22771,CLEAR DRAWER KNOB ACRYLIC EDWARDIAN,5753,6923.17,321
23543,KEEP CALM WALL ART ,1228,6877.72,94
21231,SWEETHEART CERAMIC TRINKET BOX,5757,6875.860000000001,381
21213,PACK OF 72 SKULL CAKE CASES,14309,6859.31,499
22456,NATURAL SLATE CHALKBOARD LARGE ,1452,6833.200000000001,303
23321,SMALL WHITE HEART OF WICKER,4283,6832.829999999999,582
84970S,HANGING HEART ZINC T-LIGHT HOLDER,8470,6830.589999999999,412
23236,DOILEY STORAGE TIN,2459,6828.31,284
22991,GIRAFFE WOODEN RULER,3710,6820.74,234
21035,SET/2 RED RETROSPOT TEA TOWELS ,2319,6820.01,219
22844,VINTAGE CREAM DOG FOOD CONTAINER,826,6779.35,292
22487,WHITE WOOD GARDEN PLANT LADDER,724,6778.8099999999995,379
21169,YOU'RE CONFUSING ME METAL SIGN ,4281,6762.57,342
22333,RETROSPOT PARTY BAG + STICKER SET,4391,6749.23,267
23493,VINTAGE DOILY TRAVEL SEWING KIT,3522,6747.9,349
23083,SET 6 PAPER TABLE LANTERN STARS ,1860,6739.63,209
20969,RED FLORAL FELTCRAFT SHOULDER BAG,1876,6734.31,257
84380,SET OF 3 BUTTERFLY COOKIE CUTTERS,5293,6718.9,498
22352,LUNCH BOX WITH CUTLERY RETROSPOT ,2853,6717.79,324
48111,DOORMAT 3 SMILEY CATS,1107,6715.25,174
21877,HOME SWEET HOME MUG,5347,6708.11,293
23254,CHILDRENS CUTLERY DOLLY GIRL ,1664,6704.0,276
C2,CARRIAGE,134,6686.0,133
22634,CHILDS BREAKFAST SET SPACEBOY ,731,6681.849999999999,203
23297,SET 40 HEART SHAPE PETIT FOUR CASES,4260,6677.0,140
22294,HEART FILIGREE DOVE  SMALL,5439,6671.07,246
21955,DOORMAT UNION JACK GUNS AND ROSES,1159,6635.61,155
22840,ROUND CAKE TIN VINTAGE RED,891,6600.7300000000005,250
23283,DOORMAT VINTAGE LEAVES DESIGN ,967,6600.27,209
22627,MINT KITCHEN SCALES,792,6599.79,304
22968,ROSE COTTAGE KEEPSAKE BOX ,729,6574.95,144
22725,ALARM CLOCK BAKELIKE CHOCOLATE,1776,6574.26,322
22367,CHILDRENS APRON SPACEBOY DESIGN,3543,6572.49,448
23008,DOLLY GIRL BABY GIFT SET,421,6567.95,120
22909,SET OF 20 VINTAGE CHRISTMAS NAPKINS,8122,6530.259999999999,489
23109,LED TEA LIGHTS,2325,6528.25,228
22553,PLASTERS IN TIN SKULLS,4036,6505.799999999999,439
23293,SET OF 12 FAIRY CAKE BAKING CASES,8243,6469.45,465
23103,BELL HEART DECORATION,3939,6456.149999999999,316
21259,VICTORIAN SEWING BOX SMALL ,1128,6432.110000000001,237
23134,LARGE ZINC HEART WALL ORGANISER,1064,6414.48,37
21165,BEWARE OF THE CAT METAL SIGN ,4027,6405.3099999999995,359
22170,PICTURE FRAME WOOD TRIPLE PORTRAIT,1023,6378.150000000001,225
85014A,BLACK/BLUE POLKADOT UMBRELLA,1133,6367.9400000000005,256
21122,SET/10 PINK POLKADOT PARTY CANDLES,5257,6353.58,304
23229,VINTAGE DONKEY TAIL GAME ,1804,6336.43,219
23534,STOP FOR TEA WALL ART,1207,6326.83,194
22637,PIGGY BANK RETROSPOT ,2619,6308.57,262
22505,MEMO BOARD COTTAGE DESIGN,1365,6306.1900000000005,262
21669,BLUE STRIPE CERAMIC DRAWER KNOB,4969,6284.25,351
84992,72 SWEETHEART FAIRY CAKE CASES,13070,6274.900000000001,501
22173,METAL 4 HOOK HANGER FRENCH CHATEAU,2151,6273.29,337
21533,RETROSPOT LARGE MILK JUG,1317,6267.150000000001,310
23553,LANDMARK FRAME CAMDEN TOWN ,558,6257.35,62
22381,TOY TIDY PINK POLKADOT,3169,6229.58,289
21668,RED STRIPE CERAMIC DRAWER KNOB,5035,6224.03,333
22826,LOVE SEAT ANTIQUE WHITE METAL,58,6210.0,41
23382,BOX OF 6 CHRISTMAS CAKE DECORATIONS,1712,6155.04,163
23541,WALL ART CLASSIC PUDDINGS ,829,6154.69,120
21871,SAVE THE PLANET MUG,5265,6151.78,270
22834,HAND WARMER BABUSHKA DESIGN,4633,6149.33,288
23480,MINI LIGHTS WOODLAND MUSHROOMS,1719,6126.09,173
22303,COFFEE MUG APPLES DESIGN,2770,6124.15,229
22631,CIRCUS PARADE LUNCH BOX ,3375,6122.629999999999,256
75049L,LARGE CIRCULAR MIRROR MOBILE,6821,6107.049999999999,118
21326,AGED GLASS SILVER T-LIGHT HOLDER,10088,6083.200000000001,277
22635,CHILDS BREAKFAST SET DOLLY GIRL ,657,6063.0,180
47556B,TEA TIME TEA TOWELS ,2600,6045.0,2
22663,JUMBO BAG DOLLY GIRL DESIGN,3097,6008.41,317
23307,SET OF 60 PANTRY DESIGN CAKE CASES ,11675,5982.09,504
17003,BROCADE RING PURSE ,22963,5980.05,206
22654,DELUXE SEWING KIT ,1058,5974.62,222
22943,CHRISTMAS LIGHTS 10 VINTAGE BAUBLES,1280,5968.9800000000005,159
22620,4 TRADITIONAL SPINNING TOPS,4491,5960.08,364
22508,DOORSTOP RETROSPOT HEART,1516,5938.21,236
21975,PACK OF 60 DINOSAUR CAKE CASES,12134,5934.68,529
23535,BICYCLE SAFTEY WALL ART,1128,5928.36,162
22151,PLACE SETTING WHITE HEART,14877,5922.2699999999995,289
22783,SET 3 WICKER OVAL BASKETS W LIDS,462,5922.12,32
71053,WHITE METAL LANTERN,1639,5915.95,250
21380,WOODEN HAPPY BIRTHDAY GARLAND,2093,5910.150000000001,232
21155,RED RETROSPOT PEG BAG,2460,5880.049999999999,354
22895,SET OF 2 TEA TOWELS APPLE AND PEARS,1980,5855.24,238
22356,CHARLOTTE BAG PINK POLKADOT,7306,5840.64,487
23169,CLASSIC GLASS SWEET JAR,1453,5837.950000000001,262
21535,RED RETROSPOT SMALL MILK JUG,2460,5830.2,310
47591D,PINK FAIRY CAKE CHILDRENS APRON,3144,5823.36,397
21484,CHICK GREY HOT WATER BOTTLE,1555,5810.37,282
22979,PANTRY WASHING UP BRUSH,3920,5795.86,304
23247,BISCUIT TIN 50'S CHRISTMAS,2060,5795.2,271
23172,REGENCY TEA PLATE PINK,3688,5793.28,224
22779,WOODEN OWLS LIGHT GARLAND ,1535,5781.35,147
84030E,ENGLISH ROSE HOT WATER BOTTLE,1423,5767.91,277
21888,BINGO SET,1553,5725.71,280
22784,LANTERN CREAM GAZEBO ,1214,5721.42,259
23485,BOTANICAL GARDENS WALL CLOCK ,259,5719.0,80
23113,PANTRY CHOPPING BOARD,1138,5695.86,43
62018,SOMBRERO ,4402,5691.5,59
23296,SET OF 6 TEA TIME BAKING CASES,4879,5687.150000000001,319
21922,UNION STRIPE WITH FRINGE  HAMMOCK,759,5682.09,167
84970L,SINGLE HEART ZINC T-LIGHT HOLDER,5700,5664.78,336
22485,SET OF 2 WOODEN MARKET CRATES,462,5652.9,165
48129,DOORMAT TOPIARY,880,5644.46,182
23204,CHARLOTTE BAG APPLES DESIGN,7039,5632.15,425
21672,WHITE SPOT RED CERAMIC DRAWER KNOB,4564,5618.04,307
22971,QUEENS GUARD COFFEE MUG,2365,5603.57,233
21156,RETROSPOT CHILDRENS APRON,3039,5587.87,292
84988,SET OF 72 PINK HEART PAPER DOILIES,3954,5566.679999999999,307
23311,VINTAGE CHRISTMAS STOCKING ,2199,5564.25,281
23312,VINTAGE CHRISTMAS GIFT SACK,1365,5527.150000000001,193
21912,VINTAGE SNAKES & LADDERS,1575,5523.53,268
20723,STRAWBERRY CHARLOTTE BAG,6847,5520.95,492
22584,PACK OF 6 PANNETONE GIFT BOXES,2241,5496.59,153
21094,SET/6 RED SPOTTY PAPER PLATES,7351,5496.53,325
22150,3 STRIPEY MICE FELTCRAFT,2923,5478.05,402
22740,POLKADOT PEN,6625,5475.25,107
22668,PINK BABY BUNTING,1965,5448.11,204
22751,FELTCRAFT PRINCESS OLIVIA DOLL,1514,5446.1,251
22827,RUSTIC  SEVENTEEN DRAWER SIDEBOARD,35,5415.0,26
23118,PARISIENNE JEWELLERY DRAWER ,765,5399.02,225
23135,SMALL ZINC HEART WALL ORGANISER,1538,5378.8,42
22796,PHOTO FRAME 3 CLASSIC HANGING,554,5377.45,212
23531,WALL ART BIG LOVE ,963,5340.21,97
22946,WOODEN ADVENT CALENDAR CREAM,370,5340.0,89
23126,DOLLCRAFT GIRL AMELIE KIT,1089,5297.030000000001,271
22595,CHRISTMAS GINGHAM HEART,6516,5278.86,361
23583,LUNCH BAG PAISLEY PARK  ,3315,5267.75,298
82001S,VINYL RECORD FRAME SILVER,1508,5231.08,105
22349,DOG BOWL CHASING BALL DESIGN,1341,5227.929999999999,114
23192,BUNDLE OF 3 ALPHABET EXERCISE BOOKS,3286,5225.219999999999,312
22418,10 COLOUR SPACEBOY PEN,6267,5209.17,242
23133,LARGE IVORY HEART WALL ORGANISER,759,5142.91,134
23158,SET OF 5 LUCKY CAT MAGNETS ,2538,5121.4800000000005,187
20718,RED RETROSPOT SHOPPER BAG,4264,5115.31,384
22179,SET 10 LIGHTS NIGHT OWL,796,5110.74,178
23188,VINTAGE  2 METER FOLDING RULER,3098,5103.459999999999,282
37449,CERAMIC CAKE STAND + HANGING CAKES,562,5084.78,152
22904,CALENDAR PAPER CUT DESIGN,1768,5072.64,234
22466,FAIRY TALE COTTAGE NIGHTLIGHT,2929,5071.95,150
23132,SMALL IVORY HEART WALL ORGANISER,1022,5069.58,141
23157,SET OF 6 NATIVITY MAGNETS ,2543,5058.59,145
22947,WOODEN ADVENT CALENDAR RED,536,5047.6,104
20676,RED RETROSPOT BOWL,4363,5046.9800000000005,298
21671,RED SPOT CERAMIC DRAWER KNOB,4080,5042.4,279
23177,TREASURE ISLAND BOOK BOX,2431,5036.55,214
22964,3 PIECE SPACEBOY COOKIE CUTTER SET,2514,5034.64,296
22623,BOX OF VINTAGE JIGSAW BLOCKS ,920,5031.570000000001,219
21670,BLUE SPOT CERAMIC DRAWER KNOB,4004,5028.5199999999995,289
22141,CHRISTMAS CRAFT TREE TOP ANGEL,2448,5025.580000000001,348
22780,LIGHT GARLAND BUTTERFILES PINK,1340,5018.84,130
21258,VICTORIAN SEWING BOX LARGE,425,5014.23,106
22109,FULL ENGLISH BREAKFAST PLATE,1383,4993.05,158
22296,HEART IVORY TRELLIS LARGE,3055,4988.829999999999,270
23154,SET OF 4 JAM JAR MAGNETS,2472,4986.49,214
21844,RED RETROSPOT MUG,1814,4972.1,134
22907,PACK OF 20 NAPKINS PANTRY DESIGN,6102,4966.32,533
21673,WHITE SPOT BLUE CERAMIC DRAWER KNOB,3994,4960.5,276
22302,COFFEE MUG PEARS  DESIGN,2288,4959.85,190
22839,3 TIER CAKE TIN GREEN AND CREAM,364,4954.5599999999995,136
22429,ENAMEL MEASURING JUG CREAM,1193,4954.29,315
23556,LANDMARK FRAME COVENT GARDEN ,438,4949.55,52
23310,BUBBLEGUM RING ASSORTED,11891,4894.83,213
22366,DOORMAT AIRMAIL ,722,4887.82,156
22957,SET 3 PAPER VINTAGE CHICK PAPER EGG,1749,4881.150000000001,196
22365,DOORMAT RESPECTABLE HOUSE,730,4873.44,126
84212,"ASSORTED FLOWER COLOUR ""LEIS""",10297,4871.45,103
21242,RED RETROSPOT PLATE ,3074,4860.98,222
22120,WELCOME  WOODEN BLOCK LETTERS,505,4856.5199999999995,167
21164,HOME SWEET HOME METAL SIGN ,1714,4850.620000000001,246
23263,SET OF 3 WOODEN HEART DECORATIONS,3747,4829.08,389
22464,HANGING METAL HEART LANTERN,3200,4823.499999999999,277
21124,SET/10 BLUE POLKADOT PARTY CANDLES,3970,4798.34,227
23162,REGENCY TEA STRAINER,1362,4789.24,142
22580,ADVENT CALENDAR GINGHAM SACK,836,4787.68,166
23555,LANDMARK FRAME NOTTING HILL ,422,4768.15,48
21907,I'M ON HOLIDAY METAL SIGN,2294,4761.55,329
22646,CERAMIC STRAWBERRY CAKE MONEY BANK,3927,4756.91,279
23554,LANDMARK FRAME OXFORD STREET,421,4755.65,54
22207,FRYING PAN UNION FLAG,1200,4731.36,113
21756,BATH BUILDING BLOCK WORD,792,4727.83,242
22271,FELTCRAFT DOLL ROSIE,1653,4716.870000000001,256
22297,HEART IVORY TRELLIS SMALL,3863,4715.03,221
21172,PARTY METAL SIGN ,3335,4708.2699999999995,371
22849,BREAD BIN DINER STYLE MINT,308,4706.36,119
23052,RECYCLED ACAPULCO MAT TURQUOISE,571,4694.75,221
22998,TRAVEL CARD WALLET KEEP CALM,11769,4693.4,437
22798,ANTIQUE GLASS DRESSING TABLE POT,1643,4687.01,188
