StockCode,Description,TotalQuantity,TotalRevenue,OrderCount
23068,ALUMINIUM STAMPED HEART,805,1937.2100000000003,130
22478,BIRDHOUSE GARDEN MARKER ,1417,1936.85,76
23500,KEY RING BASEBALL BOOT ASSORTED ,1585,1935.05,84
21993,FLORAL FOLK STATIONERY SET,1366,1934.8500000000001,205
21033,JUMBO BAG CHARLIE AND LOLA TOYS,922,1934.75,108
22509,SEWING BOX RETROSPOT DESIGN ,205,1931.75,80
23075,DOUBLE CERAMIC PARLOUR HOOK,470,1931.3000000000002,77
22121,NOEL WOODEN BLOCK LETTERS ,333,1930.89,114
22732,3D VINTAGE CHRISTMAS STICKERS ,1522,1930.38,126
22955,36 FOIL STAR CAKE CASES ,1005,1929.14,106
85049G,CHOCOLATE BOX RIBBONS ,1580,1926.33,227
22973,CHILDREN'S CIRCUS PARADE MUG,1192,1924.4799999999998,110
22805,BLUE DRAWER KNOB ACRYLIC EDWARDIAN,1574,1924.18,122
23213,STAR WREATH DECORATION WITH BELL,1595,1923.19,121
23145,ZINC T-LIGHT HOLDER STAR LARGE,2054,1919.3399999999997,150
21506,"FANCY FONT BIRTHDAY CARD, ",4740,1910.8799999999999,250
23235,STORAGE TIN VINTAGE LEAF,729,1902.69,96
22080,RIBBON REEL POLKADOTS ,1182,1902.3,126
22744,MAKE YOUR OWN MONSOON CARD KIT,833,1898.8300000000002,146
23161,REGENCY CAKE FORK,1608,1896.6000000000001,68
84880,WHITE WIRE EGG HOLDER,303,1896.15,65
23315,IVORY REFECTORY CLOCK,202,1894.7,76
16169E,WRAP 50'S  CHRISTMAS,4563,1892.46,149
22792,FLUTED ANTIQUE CANDLE HOLDER,2313,1888.31,128
22592,CARDHOLDER HOLLY WREATH METAL,506,1886.08,91
22374,AIRLINE BAG VINTAGE JET SET RED,448,1882.8400000000001,156
35004C,SET OF 3 COLOURED  FLYING DUCKS,393,1882.65,38
22733,3D TRADITIONAL CHRISTMAS STICKERS,1471,1882.31,141
23291,DOLLY GIRL CHILDRENS CUP,1549,1881.39,144
22996,TRAVEL CARD WALLET VINTAGE TICKET,4552,1880.16,292
22931,BAKING MOULD HEART WHITE CHOCOLATE,794,1878.61,110
23274,STAR T-LIGHT HOLDER WILLIE WINKIE,1142,1875.0599999999997,98
21249,WOODLAND  HEIGHT CHART STICKERS ,672,1874.4,79
40016,CHINESE DRAGON PAPER LANTERNS,5524,1870.7,75
20992,JAZZ HEARTS PURSE NOTEBOOK,4365,1867.05,244
22763,KEY CABINET MA CAMPAGNE,191,1865.6499999999999,93
23491,VINTAGE JINGLE BELLS HEART,226,1864.5,76
21556,CERAMIC STRAWBERRY MONEY BOX,804,1859.3999999999999,47
23289,DOLLY GIRL CHILDRENS BOWL,1553,1854.8500000000001,141
22574,HEART WOODEN CHRISTMAS DECORATION,2124,1854.54,157
22897,OVEN MITT APPLES DESIGN,1298,1850.66,172
23357,HOT WATER BOTTLE SEX BOMB,435,1843.5500000000002,88
37450,CERAMIC CAKE BOWL + HANGING CAKES,668,1841.0,98
23359,SET OF 12 T-LIGHTS VINTAGE DOILEY,979,1840.6499999999999,76
23094,LE GRAND TRAY CHIC SET,147,1837.5,74
22859,EASTER TIN BUNNY BOUQUET,1150,1832.6999999999998,127
22601,CHRISTMAS RETROSPOT ANGEL WOOD,2238,1827.4199999999998,150
47504K,ENGLISH ROSE GARDEN SECATEURS,1958,1826.78,174
22736,RIBBON REEL MAKING SNOWMEN ,1102,1825.46,152
22571,ROCKING HORSE RED CHRISTMAS ,2207,1813.55,176
23367,SET 12 COLOUR PENCILS SPACEBOY ,2785,1807.8500000000001,231
21042,RED RETROSPOT APRON ,303,1802.8500000000001,105
22291,HANGING CHICK CREAM DECORATION,1243,1802.35,90
22747,POPPY'S PLAYHOUSE BATHROOM,879,1800.9,169
21034,REX CASH+CARRY JUMBO SHOPPER,1893,1798.35,859
22807,SET OF 6 T-LIGHTS TOADSTOOLS,676,1796.64,107
23005,TRAVEL CARD WALLET I LOVE LONDON,4396,1788.72,175
84968A,SET OF 16 VINTAGE ROSE CUTLERY,147,1787.85,48
10135,COLOURING PENCILS BROWN TUBE,1938,1786.69,117
21622,VINTAGE UNION JACK CUSHION COVER,364,1785.0,92
22412,METAL SIGN NEIGHBOURHOOD WITCH ,877,1784.7000000000003,113
23371,SET 36 COLOUR PENCILS SPACEBOY ,1505,1783.97,133
22536,MAGIC DRAWING SLATE PURDEY,4721,1782.18,144
23525,BUFFALO BILL WALL ART ,568,1781.64,44
22477,WATERING CAN GARDEN MARKER,1290,1778.1,70
51014A,"FEATHER PEN,HOT PINK",3621,1777.61,157
37446,MINI CAKE STAND WITH HANGING CAKES,1297,1775.05,148
21916,SET 12 RETRO WHITE CHALK STICKS,4363,1771.54,248
23148,MINIATURE ANTIQUE ROSE HOOK IVORY,2118,1756.4999999999998,234
21584,RETROSPOT SMALL TUBE MATCHES,1066,1754.8999999999999,146
21873,IF YOU CAN'T STAND THE HEAT MUG,1586,1752.34,88
72802B,OCEAN SCENT CANDLE IN JEWELLED BOX,968,1749.94,75
21990,MODERN FLORAL STATIONERY SET,1219,1745.05,177
22710,WRAP I LOVE LONDON ,4425,1742.5,100
22593,CHRISTMAS GINGHAM STAR,2049,1736.9699999999998,138
15044D,RED PAPER PARASOL,630,1735.74,73
22534,MAGIC DRAWING SLATE SPACEBOY ,4331,1735.5,202
22788,BROCANTE COAT RACK,205,1734.05,46
22639,SET OF 4 NAPKIN CHARMS HEARTS,763,1733.37,127
22588,CARD HOLDER GINGHAM HEART,605,1732.4099999999999,135
22119,PEACE WOODEN BLOCK LETTERS,348,1731.3600000000001,103
23228,FILIGREE HEART BIRD WHITE ,1397,1726.3,78
22186,RED STAR CARD HOLDER,801,1723.79,118
23090,VINTAGE GLASS T-LIGHT HOLDER,2130,1723.62,122
22712,CARD DOLLY GIRL ,4319,1721.37,213
21845,DAIRY MAID STRIPE MUG,1907,1721.0900000000001,82
22562,MONSTERS STENCIL CRAFT,1398,1720.42,190
22858,EASTER TIN KEEPSAKE,1081,1718.85,110
22803,IVORY EMBROIDERED QUILT ,46,1715.9,25
22986,GINGHAM ROSE WRAP,4101,1710.42,154
20982,12 PENCILS TALL TUBE SKULLS,2019,1709.9099999999999,215
22115,METAL SIGN EMPIRE TEA,1495,1706.8100000000002,183
21114,LAVENDER SCENTED FABRIC HEART,1352,1705.28,128
22027,TEA PARTY BIRTHDAY CARD,4165,1702.79,262
21471,STRAWBERRY RAFFIA FOOD COVER,495,1702.65,92
21041,RED RETROSPOT OVEN GLOVE DOUBLE,576,1699.2000000000003,138
23073,GEORGIAN TRINKET BOX,142,1694.0,59
23244,ROUND STORAGE TIN VINTAGE LEAF,925,1692.9099999999999,105
21586,KINGS CHOICE GIANT TUBE MATCHES,731,1691.25,66
23358,HOT STUFF HOT WATER BOTTLE,528,1689.9,67
16161U,WRAP SUKI AND FRIENDS,4075,1687.5,134
21564,PINK  HEART SHAPE LOVE BUCKET ,1016,1686.5200000000002,103
23155,KNICKERBOCKERGLORY MAGNET ASSORTED ,2106,1679.34,111
21989,PACK OF 20 SKULL PAPER NAPKINS,2068,1675.24,205
21870,I CAN ONLY PLEASE ONE PERSON MUG,1357,1668.89,137
23160,REGENCY TEA SPOON,1404,1666.8,60
22579,WOODEN TREE CHRISTMAS SCANDINAVIAN,4808,1665.1599999999999,276
22055,MINI CAKE STAND  HANGING STRAWBERY,1248,1665.08,142
21988,PACK OF 6 SKULL PAPER PLATES,2194,1663.3,147
51008,AFGHAN SLIPPER SOCK PAIR,511,1662.95,19
23057,GEMSTONE CHANDELIER T-LIGHT HOLDER,677,1660.99,41
21992,VINTAGE PAISLEY STATIONERY SET,1163,1658.69,199
70006,LOVE HEART POCKET WARMER,2620,1657.6999999999998,78
21917,SET 12 KIDS  WHITE CHALK STICKS,4095,1653.24,186
23370,SET 36 COLOUR PENCILS DOILEY,1359,1650.1100000000001,106
20674,GREEN POLKADOT BOWL,1373,1649.06,149
22602,CHRISTMAS RETROSPOT HEART WOOD,1962,1647.4199999999998,174
22414,DOORMAT NEIGHBOURHOOD WITCH ,253,1645.67,70
22832,BROCANTE SHELF WITH HOOKS,155,1645.45,69
47570B,TEA TIME TABLE CLOTH,180,1642.68,26
21056,DOCTOR'S BAG SOFT TOY,174,1640.1799999999998,66
21068,VINTAGE BILLBOARD LOVE/HATE MUG,1535,1637.71,125
23214,JINGLE BELL HEART ANTIQUE GOLD,777,1635.23,92
21899,"KEY FOB , GARAGE DESIGN",2605,1633.0700000000002,218
23434,3 RAFFIA RIBBONS 50'S CHRISTMAS ,1792,1632.4,134
23096,PETIT TRAY CHIC,1007,1629.83,117
22544,MINI JIGSAW SPACEBOY,4414,1628.3,124
23270,SET OF 2 CERAMIC PAINTED HEARTS ,1166,1625.8999999999999,118
21494,ROTATING LEAVES T-LIGHT HOLDER,1228,1624.73,126
21245,GREEN POLKADOT PLATE ,1014,1623.1,100
21718,RED METAL BEACH SPADE ,1289,1613.67,143
85035C,ROSE 3 WICK MORRIS BOX CANDLE,1105,1611.45,107
85061W,WHITE JEWELLED HEART DECORATION,1986,1609.8,108
22789,T-LIGHT HOLDER SWEETHEART HANGING,838,1605.84,126
22651,GENTLEMAN SHIRT REPAIR KIT ,1992,1602.7199999999998,94
21534,DAIRY MAID LARGE MILK JUG,327,1593.45,124
85015,SET OF 12  VINTAGE POSTCARD SET,2130,1591.42,113
22156,HEART DECORATION WITH PEARLS ,1875,1588.1599999999999,152
21439,BASKET OF TOADSTOOLS,1322,1574.98,77
23101,SILVER STARS TABLE DECORATION,1948,1574.6,190
20981,12 PENCILS TALL TUBE WOODLAND,1851,1573.35,208
22037,ROBOT BIRTHDAY CARD,3795,1573.12,257
84356,POMPOM CURTAIN,337,1570.15,46
23217,LAUREL HEART ANTIQUE SILVER,1290,1567.0,84
22110,BIRD HOUSE HOT WATER BOTTLE,618,1564.61,154
22332,SKULLS PARTY BAG + STICKER SET,982,1562.6999999999998,129
46000M,POLYESTER FILLER PAD 45x45cm,1008,1562.4,133
84596F,SMALL MARSHMALLOWS PINK BOWL,3301,1561.6299999999999,288
85034C,3 ROSE MORRIS BOXED CANDLES,1072,1560.64,131
22305,COFFEE MUG PINK PAISLEY DESIGN,684,1559.44,44
23317,BLUE REFECTORY CLOCK ,162,1557.8999999999999,70
23122,PARTY CHARMS 50 PIECES,2093,1554.31,94
37495,FAIRY CAKE BIRTHDAY CANDLE SET,428,1547.4,84
23280,FOLDING BUTTERFLY MIRROR HOT PINK ,1995,1546.91,133
23399,HOME SWEET HOME HANGING HEART,1823,1546.4299999999998,176
23483,HANGING  BUTTERFLY T-LIGHT HOLDER,1322,1541.62,66
21394,RED POLKADOT BEAKER ,3822,1538.62,114
22674,FRENCH TOILET SIGN BLUE METAL,1274,1536.71,144
22928,YELLOW GIANT GARDEN THERMOMETER,251,1535.5700000000002,88
21207,SKULL AND CROSSBONES  GARLAND ,982,1533.8999999999999,84
23273,HEART T-LIGHT HOLDER WILLIE WINKIE,928,1533.84,97
22828,REGENCY MIRROR WITH SHUTTERS,10,1530.0,7
22428,ENAMEL FIRE BUCKET CREAM,221,1528.73,92
22398,MAGNETS PACK OF 4 SWALLOWS,2545,1528.68,228
22934,BAKING MOULD EASTER EGG WHITE CHOC,560,1527.2,69
23372,SET 36 COLOUR PENCILS DOLLY GIRL,1296,1522.72,99
21544,SKULLS  WATER TRANSFER TATTOOS ,1872,1522.3999999999999,113
22434,BALLOON PUMP WITH 10 BALLOONS,779,1521.23,112
22292,HANGING CHICK  YELLOW DECORATION,1088,1520.0,88
22891,TEA FOR ONE POLKADOT,345,1519.01,104
22361,GLASS JAR DAISY FRESH COTTON WOOL,539,1513.2500000000002,123
22479,DAISY GARDEN MARKER,1078,1513.1,54
21981,PACK OF 12 WOODLAND TISSUES ,5295,1512.9299999999998,190
22377,BOTTLE BAG RETROSPOT ,1038,1510.89,105
22852,DOG BOWL VINTAGE CREAM,354,1507.92,108
21967,PACK OF 12 SKULL TISSUES,5166,1506.24,173
22220,CAKE STAND LOVEBIRD 2 TIER WHITE,214,1499.5,74
22799,SWEETHEART WIRE FRUIT BOWL,198,1497.8,79
22165,"DIAMANTE HEART SHAPED WALL MIRROR, ",267,1490.65,38
22985,"WRAP, BILLBOARD FONTS DESIGN",3750,1487.0,96
22284,HEN HOUSE DECORATION,901,1486.6499999999999,99
23181,BULL DOG BOTTLE TOP WALL CLOCK,185,1484.25,69
22313,OFFICE MUG WARMER PINK,553,1482.89,54
15060B,FAIRY CAKE DESIGN UMBRELLA,411,1482.87,95
23462,ROCOCO WALL MIRROR WHITE,77,1482.1499999999999,44
23394,POSTE FRANCE CUSHION COVER,395,1481.25,119
22594,CHRISTMAS GINGHAM TREE,1744,1480.06,125
22913,RED COAT RACK PARIS FASHION,327,1479.69,95
23226,FILIGREE HEART DAISY WHITE,1199,1478.59,71
18097C,WHITE TALL PORCELAIN T-LIGHT HOLDER,673,1471.3500000000001,52
85049C,ROMANTIC PINKS RIBBONS ,1198,1471.35,205
22671,FRENCH LAUNDRY SIGN BLUE METAL,919,1465.31,103
84818,DANISH ROSE PHOTO FRAME,1424,1461.6,99
23391, I LOVE LONDON MINI BACKPACK,361,1458.15,69
22154,ANGEL DECORATION 3 BUTTONS ,3532,1457.52,111
21591,COSY HOUR CIGAR BOX MATCHES ,1187,1456.39,143
22312,OFFICE MUG WARMER POLKADOT,503,1454.9900000000002,93
23287,RED VINTAGE SPOT BEAKER,1782,1452.3,146
85206A,CREAM FELT EASTER EGG BASKET,916,1450.1999999999998,103
21713,CITRONELLA CANDLE FLOWERPOT,701,1448.1000000000001,125
21626,VINTAGE UNION JACK PENNANT,742,1446.8999999999999,74
21206,STRAWBERRY HONEYCOMB  GARLAND ,1220,1446.6,75
21509,COWBOYS AND INDIANS BIRTHDAY CARD ,3581,1444.75,203
72807B,SET/3 OCEAN SCENT CANDLE JEWEL BOX,350,1443.5,78
23524,HORSE & PONY WALL ART,465,1441.98,51
22314,OFFICE MUG WARMER CHOC+BLUE,517,1434.0900000000001,93
22095,LADS ONLY TISSUE BOX,1578,1432.04,102
22530,MAGIC DRAWING SLATE DOLLY GIRL ,3514,1431.96,181
22364,GLASS JAR DIGESTIVE BISCUITS,519,1429.97,95
23267,SET OF 4 SANTA PLACE SETTINGS,1158,1427.34,91
22282,12 EGG HOUSE PAINTED WOOD,111,1425.27,64
22675,FRENCH KITCHEN SIGN BLUE METAL,1176,1423.89,123
22176,BLUE OWL SOFT TOY,489,1423.3500000000001,98
21898,POTTING SHED ROSE CANDLE,445,1423.03,7
22816,CARD MOTORBIKE SANTA,3438,1420.2,176
22085,PAPER CHAIN KIT SKULLS ,507,1415.65,73
20668,DISCO BALL CHRISTMAS DECORATION,12714,1408.56,181
22526,WHEELBARROW FOR CHILDREN ,112,1406.4,67
72807A,SET/3 ROSE CANDLE IN JEWELLED BOX,340,1406.28,66
22975,SPACEBOY CHILDRENS EGG CUP,1118,1405.97,142
20963,APPLE BATH SPONGE,1102,1400.49,122
23527,ANIMALS AND NATURE WALL ART,416,1398.72,43
23368,SET 12 COLOUR PENCILS DOLLY GIRL ,2155,1398.3500000000001,178
22853,CAT BOWL VINTAGE CREAM,431,1396.95,101
21192,WHITE BELL HONEYCOMB PAPER ,925,1391.85,39
21792,CLASSIC FRENCH STYLE BASKET GREEN ,331,1388.65,70
84971S,SMALL HEART FLOWERS HOOK ,1679,1386.75,114
22047,EMPIRE GIFT WRAP,3400,1384.0,105
23528,SPACEBOY WALL ART,462,1381.38,34
22285,"DECORATION HEN ON NEST, HANGING",834,1376.1,90
23546,WRAP PAISLEY PARK ,3275,1375.5,120
22436,12 COLOURED PARTY BALLOONS,2110,1373.3,139
22949,36 DOILIES DOLLY GIRL,947,1373.1499999999999,86
23086,ZINC  STAR T-LIGHT HOLDER ,1194,1371.54,36
23348,CHILDRENS TOY COOKING UTENSIL SET,680,1371.48,122
22458,CAST IRON HOOK GARDEN FORK,513,1371.4299999999998,14
21872,GLAMOROUS  MUG,1269,1370.73,119
22198,LARGE POPCORN HOLDER ,873,1370.4499999999998,53
22445,PENCIL CASE LIFE IS BEAUTIFUL,472,1368.2,93
21055,TOOL BOX SOFT TOY ,146,1368.1399999999999,82
22498,WOODEN REGATTA BUNTING,229,1362.5500000000002,96
85034B,3 WHITE CHOC MORRIS BOXED CANDLES,884,1362.44,90
22731,3D CHRISTMAS STAMPS STICKERS ,1075,1361.95,105
23250,VINTAGE RED TRIM ENAMEL BOWL ,1103,1358.59,89
21714,CITRONELLA CANDLE GARDEN POT,1085,1356.25,126
23104,IVORY PANTRY HANGING LAMP ,116,1355.5,44
22583,PACK OF 6 HANDBAG GIFT BOXES,529,1348.9499999999998,77
22531,MAGIC DRAWING SLATE CIRCUS PARADE  ,3293,1348.5,163
85040A,S/4 PINK FLOWER CANDLES IN BOWL,807,1348.1899999999998,125
23414,ZINC BOX SIGN HOME,139,1348.01,62
23334,IVORY WICKER HEART SMALL,2154,1345.5,95
84032B,CHARLIE + LOLA RED HOT WATER BOTTLE,654,1342.0000000000002,130
21537,RED RETROSPOT PUDDING BOWL,327,1341.75,57
22358,KINGS CHOICE TEA CADDY ,456,1341.2800000000002,110
21829,DINOSAUR KEYRINGS ASSORTED,6462,1332.9299999999998,131
22357,KINGS CHOICE BISCUIT TIN,324,1332.6,87
23034,DRAWER KNOB CERAMIC BLACK,947,1332.35,78
22199,FRYING PAN RED RETROSPOT,384,1328.5,98
85232B,SET OF 3 BABUSHKA STACKING TINS,268,1326.6,9
22714,CARD BIRTHDAY COWBOY,3367,1324.8899999999999,155
23470,CARD HOLDER LOVE BIRD LARGE ,220,1323.4,75
21519,GIN & TONIC DIET GREETING CARD ,3217,1320.9,191
22818,CARD CHRISTMAS VILLAGE,3162,1319.4,162
72349B,SET/6 PURPLE BUTTERFLY T-LIGHTS,689,1318.98,91
21578,WOODLAND DESIGN  COTTON TOTE BAG,586,1318.5,82
23040,PAPER LANTERN 9 POINT SNOW STAR ,246,1318.5,36
23271,CHRISTMAS TABLE CANDLE SILVER SPIKE,1622,1316.82,75
21507,"ELEPHANT, BIRTHDAY CARD, ",3206,1314.0,198
22976,CIRCUS PARADE CHILDRENS EGG CUP ,1047,1313.59,112
22713,CARD I LOVE LONDON ,3309,1312.12,149
90057,DIAMANTE RING ASSORTED IN BOX.,1008,1311.3600000000001,22
22399,MAGNETS PACK OF 4 CHILDHOOD MEMORY,1130,1309.9,87
22982,PANTRY PASTRY BRUSH,1045,1308.3,146
22696,WICKER WREATH LARGE,694,1307.36,123
21832,CHOCOLATE CALCULATOR,785,1306.7299999999998,115
20961,STRAWBERRY BATH SPONGE ,1029,1305.61,127
22076,6 RIBBONS EMPIRE  ,1035,1304.37,113
22676,FRENCH BLUE METAL DOOR SIGN 1,1040,1303.64,138
22600,CHRISTMAS RETROSPOT STAR WOOD,1540,1303.54,143
22306,SILVER MUG BONE CHINA TREE OF LIFE,1138,1303.29,99
21705,BAG 500g SWIRLY MARBLES,1377,1299.2099999999998,110
22071,SMALL WHITE RETROSPOT MUG IN BOX ,711,1298.79,72
84510A,SET OF 4 ENGLISH ROSE COASTERS,1063,1295.59,144
23249,VINTAGE RED ENAMEL TRIM PLATE,802,1294.4999999999998,68
23055,IVORY CHANDELIER T-LIGHT HOLDER,561,1292.97,36
21111,"SWISS ROLL TOWEL, CHOCOLATE  SPOTS",789,1291.55,50
22948,METAL DECORATION NAUGHTY CHILDREN ,1456,1286.56,98
21039,RED RETROSPOT SHOPPING BAG,510,1284.6599999999999,77
35953,FOLKART STAR CHRISTMAS DECORATIONS,3017,1282.4099999999999,85
21818,GLITTER CHRISTMAS HEART ,2699,1281.13,147
22503,CABIN BAG VINTAGE PAISLEY,64,1279.2,16
23538,WALL ART VINTAGE HEART,327,1278.87,27
21470,FLOWER VINE RAFFIA FOOD COVER,338,1278.63,114
22227,HANGING HEART MIRROR DECORATION ,1969,1276.8500000000001,170
23119,PACK OF 6 LARGE FRUIT STRAWS ,2156,1276.33,116
72802A,ROSE SCENT CANDLE IN JEWELLED BOX,316,1275.92,55
23000,TRAVEL CARD WALLET TRANSPORT,3044,1275.6,205
23378,PACK OF 12 50'S CHRISTMAS TISSUES,3419,1272.9299999999998,144
21200,MULTICOLOUR HONEYCOMB PAPER GARLAND,1010,1272.8999999999999,39
22716,CARD CIRCUS PARADE,3088,1272.27,214
21686,MEDINA STAMPED METAL STOOL,33,1268.3500000000001,18
22304,COFFEE MUG BLUE PAISLEY DESIGN,744,1268.06,47
84969,BOX OF 6 ASSORTED COLOUR TEASPOONS,295,1267.99,73
21328,BALLOONS  WRITING SET ,760,1262.1999999999998,187
35924,HANGING FAIRY CAKE DECORATION,724,1262.1,31
47503A,ASS FLORAL PRINT MULTI SCREWDRIVER,2754,1261.69,161
22130,PARTY CONE CHRISTMAS DECORATION ,1505,1260.53,88
84580,MOUSE TOY WITH PINK T-SHIRT,335,1260.05,120
23469,CARD HOLDER LOVE BIRD SMALL,320,1255.7600000000002,63
21987,PACK OF 6 SKULL PAPER CUPS,2050,1254.74,147
84279P,CHERRY BLOSSOM  DECORATIVE FLASK,339,1253.97,94
21619,4 VANILLA BOTANICAL CANDLES,900,1252.5,121
22461,SAVOY ART DECO CLOCK,231,1251.25,45
22591,CARDHOLDER GINGHAM CHRISTMAS TREE,374,1250.84,63
21897,POTTING SHED CANDLE CITRONELLA,402,1250.82,2
22335,HEART DECORATION PAINTED ZINC ,2024,1250.2,123
84795B,SUNSET CHECK HAMMOCK,167,1249.65,40
15044A,PINK PAPER PARASOL ,428,1248.2800000000002,78
23505,PLAYING CARDS I LOVE LONDON ,1065,1247.25,104
22911,PAPER CHAIN KIT LONDON,438,1246.94,81
22742,MAKE YOUR OWN PLAYTIME CARD KIT,628,1245.88,88
71038,WHITE HANGING BEADS CANDLE HOLDER,239,1244.95,47
23373,VINTAGE CHRISTMAS PAPER GIFT BAG,1563,1241.6599999999999,88
23221,REINDEER HEART DECORATION SILVER,1461,1241.59,110
21793,CLASSIC FRENCH STYLE BASKET BROWN,296,1240.44,66
22473,TV DINNER TRAY VINTAGE PAISLEY,437,1239.39,79
22419,LIPSTICK PEN RED,2812,1236.1200000000001,157
21577,SAVE THE PLANET COTTON TOTE BAG,549,1235.25,116
22208,WOOD STAMP SET THANK YOU,1289,1234.1,199
22472,TV DINNER TRAY DOLLY GIRL,293,1234.0700000000002,80
85054,FRENCH ENAMEL POT W LID,551,1233.3100000000002,87
22299,PIG KEYRING WITH LIGHT & SOUND ,1316,1231.34,42
23071,MARIE ANTOIENETT TRINKET BOX GOLD,317,1230.1,17
21528,DAIRY MAID TRADITIONAL TEAPOT ,179,1230.05,86
85183B,CHARLIE & LOLA WASTEPAPER BIN FLORA,977,1228.25,106
22363,GLASS JAR MARMALADE ,454,1226.94,57
22922,FRIDGE MAGNETS US DINER ASSORTED,1482,1226.3999999999999,88
22475,SKULL DESIGN TV DINNER TRAY,281,1225.95,109
22905,CALENDAR IN SEASON DESIGN,478,1225.49,67
22770,MIRROR CORNICE,83,1223.25,55
22912,YELLOW COAT RACK PARIS FASHION,270,1222.74,90
22609,PENS ASSORTED SPACEBALL,5636,1219.8799999999999,118
22576,SWALLOW WOODEN CHRISTMAS DECORATION,1419,1218.6299999999999,125
21422,PORCELAIN ROSE SMALL,1560,1218.36,46
22449,SILK PURSE BABUSHKA PINK,365,1217.68,87
22443,GROW YOUR OWN HERBS SET OF 3,153,1216.3500000000001,80
21123,SET/10 IVORY POLKADOT PARTY CANDLES,975,1215.81,97
23366,SET 12 COLOURING PENCILS DOILY,1923,1211.5500000000002,141
21620,SET OF 4 ROSE BOTANICAL CANDLES,811,1211.25,124
22200,FRYING PAN PINK POLKADOT,326,1209.54,76
23138,SINGLE WIRE HOOK IVORY HEART,875,1209.1499999999999,75
22278,OVERNIGHT BAG VINTAGE ROSE PAISLEY,244,1207.8000000000002,82
22999,TRAVEL CARD WALLET RETRO PETALS,2875,1206.06,185
22028,PENNY FARTHING BIRTHDAY CARD,2915,1203.49,185
23444,Next Day Carriage,79,1200.0,79
23061,VINTAGE EMBOSSED HEART,964,1199.96,88
22929,SCHOOL DESK AND CHAIR ,19,1199.75,13
84968C,SET OF 16 VINTAGE PISTACHIO CUTLERY,94,1198.5,48
22917,HERB MARKER ROSEMARY,1858,1195.7,190
21615,4 LAVENDER BOTANICAL DINNER CANDLES,840,1195.0,100
21864,UNION JACK FLAG PASSPORT COVER ,610,1192.44,96
84828,JUNGLE POPSICLES ICE LOLLY HOLDERS,954,1192.41,111
21624,VINTAGE UNION JACK DOORSTOP,204,1190.8000000000002,82
22293,HANGING CHICK GREEN DECORATION,821,1190.4499999999998,82
84012,MAGIC SHEEP WOOL GROWING FROM PAPER,1212,1190.0,94
21813,GARLAND WITH STARS AND BELLS,250,1187.1000000000001,40
22711,WRAP CIRCUS PARADE,2852,1181.84,100
51014C,"FEATHER PEN,COAL BLACK",2462,1180.26,110
22664,TOY TIDY DOLLY GIRL DESIGN,642,1178.18,102
23598,PAPER BUNTING VINTAGE PARTY,421,1177.95,42
22442,GROW YOUR OWN FLOWERS SET OF 3,292,1177.8,74
22439,6 ROCKET BALLOONS ,1768,1176.8000000000002,156
21902,"KEY FOB , FRONT  DOOR ",1915,1176.73,161
23392,SPACEBOY ROCKET LOLLY MAKERS,592,1175.68,78
22416,SET OF 36 DOILIES SPACEBOY DESIGN ,850,1174.8999999999999,63
22168,ORGANISER WOOD ANTIQUE WHITE ,139,1171.3,75
22916,HERB MARKER THYME,1819,1170.3500000000001,186
20984,12 PENCILS TALL TUBE POSY,3809,1169.0099999999998,167
21382,SET/4 SPRING FLOWER DECORATION,1045,1164.3500000000001,93
22318,FIVE HEART HANGING DECORATION,396,1161.0000000000002,89
20985,HEART CALCULATOR,1017,1160.88,87
22575,METAL MERRY CHRISTMAS WREATH,622,1160.1,76
23523,TREASURE AHOY WALL ART,357,1151.43,38
22613,PACK OF 20 SPACEBOY NAPKINS,1488,1150.3799999999999,114
23067,HANGING ENGRAVED METAL HEART,277,1149.5500000000002,71
22708,WRAP DOLLY GIRL,2775,1149.5,99
21742,LARGE ROUND WICKER PLATTER ,193,1148.35,89
84536A,ENGLISH ROSE NOTEBOOK A7 SIZE,2729,1147.0,221
84813,SET OF 4 DIAMOND NAPKIN RINGS,145,1146.97,22
21211,SET OF 72 SKULL PAPER  DOILIES,816,1144.8,66
10133,COLOURING PENCILS BROWN TUBE,2384,1143.6100000000001,122
21901,"KEY FOB , BACK DOOR ",1746,1142.8600000000001,234
21913,VINTAGE SEASIDE JIGSAW PUZZLES,305,1142.53,89
37342,POLKADOT COFFEE CUP & SAUCER PINK,1435,1142.29,63
23405,HOME SWEET HOME 2 DRAWER CABINET,237,1137.95,57
23142,IVORY WIRE KITCHEN ORGANISER,116,1137.65,36
22650,CERAMIC PIRATE CHEST MONEY BANK,800,1136.0,106
23559,WOODLAND BUNNIES LOLLY MAKERS,566,1135.52,75
21706,FOLDING UMBRELLA RED/WHITE POLKADOT,229,1134.58,68
85159B,"WHITE TEA,COFFEE,SUGAR JARS",622,1134.5,59
21012,ANTIQUE ALL GLASS CANDLESTICK,567,1133.3000000000002,80
15039,SANDALWOOD FAN,1559,1133.15,70
22977,DOLLY GIRL CHILDRENS EGG CUP,905,1132.46,111
21986,PACK OF 12 PINK POLKADOT TISSUES,3985,1129.79,155
23539,WALL ART LOVES' SECRET ,237,1129.71,35
23507,MINI PLAYING CARDS BUFFALO BILL ,2841,1129.02,101
21744,SNOWFLAKE PORTABLE TABLE LIGHT ,367,1128.0900000000001,80
21361,LOVE LARGE WOOD LETTERS ,91,1127.85,54
22063,CERAMIC BOWL WITH STRAWBERRY DESIGN,544,1127.2,81
22944,CHRISTMAS METAL POSTCARD WITH BELLS,2704,1125.94,57
22918,HERB MARKER PARSLEY,1776,1122.4,187
22060,LARGE CAKE STAND HANGING HEARTS,233,1118.95,34
21352,EUCALYPTUS & PINECONE  WREATH,311,1118.65,37
23431,NATURAL HANGING QUILTED HEARTS ,1432,1117.28,67
23506,MINI PLAYING CARDS SPACEBOY ,2718,1116.36,127
84032A,CHARLIE+LOLA PINK HOT WATER BOTTLE,449,1112.91,105
85227,SET OF 6 3D KIT CARDS FOR KIDS,1322,1107.08,147
22754,SMALL RED BABUSHKA NOTEBOOK ,1802,1106.4399999999998,194
22735,RIBBON REEL SOCKS AND MITTENS,673,1106.13,86
37447,CERAMIC CAKE DESIGN SPOTTED PLATE,757,1104.8899999999999,76
15058A,BLUE POLKADOT GARDEN PARASOL,148,1104.6,51
22915,ASSORTED BOTTLE TOP  MAGNETS ,2928,1104.36,133
22494,EMERGENCY FIRST AID TIN ,890,1102.64,119
22334,DINOSAUR PARTY BAG + STICKER SET,684,1101.44,91
22320,BIRDS MOBILE VINTAGE DESIGN,183,1100.21,69
23072,MARIE ANTOINETTE TRINKET BOX SILVER,326,1099.0,22
22471,TV DINNER TRAY AIR HOSTESS ,360,1097.68,64
21395,BLUE POLKADOT BEAKER ,2812,1096.6799999999998,78
22452,MEASURING TAPE BABUSHKA PINK,388,1094.8000000000002,66
21616,4 PEAR BOTANICAL DINNER CANDLES,755,1093.75,104
21830,ASSORTED CREEPY CRAWLIES,2599,1093.63,88
47480,HANGING PHOTO CLIP ROPE LADDER,692,1092.8799999999999,52
22677,FRENCH BLUE METAL DOOR SIGN 2,874,1092.51,113
23225,CHERUB HEART DECORATION SILVER ,1297,1090.4299999999998,69
22603,CHRISTMAS RETROSPOT TREE WOOD,1295,1089.83,125
82578,KITCHEN METAL SIGN,1956,1088.5600000000002,220
21820,GLITTER HEART GARLAND WITH BELLS ,291,1079.84,58
23041,PAPER LANTERN 9 POINT SNOW STAR,260,1079.0,48
84884A,ANT WHITE WIRE HEART SPIRAL,286,1076.66,64
21700,BIG DOUGHNUT FRIDGE MAGNETS,1266,1076.1,85
23269,SET OF 2 CERAMIC CHRISTMAS TREES,755,1075.55,76
23515,EMBROIDERED RIBBON REEL DAISY ,558,1075.3799999999999,59
22073,RED RETROSPOT STORAGE JAR,300,1074.6,45
22984,CARD GINGHAM ROSE ,2678,1073.74,140
23513,EMBROIDERED RIBBON REEL SUSIE ,556,1072.96,62
22919,HERB MARKER MINT,1669,1072.8500000000001,191
23418,LAVENDER TOILETTE BOTTLE,534,1068.96,60
23375,50'S CHRISTMAS PAPER GIFT BAG,1327,1068.1399999999999,88
22167, OVAL WALL MIRROR DIAMANTE ,121,1059.95,58
22997,TRAVEL CARD WALLET UNION JACK,2527,1059.9,181
21070,VINTAGE BILLBOARD MUG ,1033,1059.79,77
22921,HERB MARKER CHIVES ,1648,1059.2,166
21693,SMALL HAMMERED SILVER CANDLEPOT ,358,1056.1000000000001,43
22375,AIRLINE BAG VINTAGE JET SET BROWN,253,1056.05,96
22802,FAUX FUR CHOCOLATE THROW,66,1055.7,34
21819,GLITTER CHRISTMAS STAR ,2465,1054.63,118
16016,LARGE CHINESE STYLE SCISSOR,1273,1053.45,65
23369,SET 36 COLOUR PENCILS LOVE LONDON,901,1053.29,95
85036C,ROSE 1 WICK MORRIS BOXED CANDLE,742,1051.52,76
23511,EMBROIDERED RIBBON REEL EMILY ,526,1050.58,85
22539,MINI JIGSAW DOLLY GIRL,2824,1050.41,85
22572,ROCKING HORSE GREEN CHRISTMAS ,1265,1050.29,126
85132B,CHARLIE AND LOLA TABLE TINS,513,1048.35,60
23432,PRETTY HANGING QUILTED HEARTS,1274,1046.86,70
22923,FRIDGE MAGNETS LES ENFANTS ASSORTED,1281,1042.05,75
21812,GARLAND WITH HEARTS AND BELLS,218,1037.1000000000001,42
22066,LOVE HEART TRINKET POT,2248,1035.3799999999999,131
84968E,SET OF 16 VINTAGE BLACK CUTLERY,87,1035.06,22
21363,HOME SMALL WOOD LETTERS,209,1034.55,90
21464,DISCO BALL ROTATOR BATTERY OPERATED,244,1034.0,102
23402,HOME SWEEET HOME 3 PEG HANGER ,281,1031.67,55
23516,EMBROIDERED RIBBON REEL SOPHIE  ,292,1028.76,40
21071,VINTAGE BILLBOARD DRINK ME MUG,849,1025.98,107
23545,WRAP RED DOILEY,2475,1023.5,83
21179,NO JUNK MAIL METAL SIGN,1785,1021.23,166
23026,DRAWER KNOB VINTAGE GLASS STAR,504,1019.0500000000001,53
22611,VINTAGE UNION JACK SHOPPING BAG,219,1016.85,40
23411, TRELLIS COAT RACK,217,1016.5500000000001,46
84944,SET OF 6 KASHMIR FOLKART BAUBLES,564,1016.4,71
23544,WALL ART MID CENTURY MODERN ,164,1015.78,20
23508,MINI PLAYING CARDS DOLLY GIRL ,2476,1014.72,106
22755,SMALL PURPLE BABUSHKA NOTEBOOK ,1577,1012.78,193
22153,ANGEL DECORATION STARS ON DRESS,2459,1012.62,86
23327,HANGING CLEAR MINI BOTTLE,1710,1012.0200000000001,34
82567,"AIRLINE LOUNGE,METAL SIGN",497,1011.4100000000001,149
22474,SPACEBOY TV DINNER TRAY,244,1009.0400000000001,83
22402,MAGNETS PACK OF 4 VINTAGE COLLAGE,1705,1008.14,144
23460,SWEETHEART WALL TIDY ,108,1007.0799999999999,43
23102,SILVER HEARTS TABLE DECORATION,1245,1006.9499999999999,139
21984,PACK OF 12 PINK PAISLEY TISSUES ,3309,1003.9499999999999,157
