StockCode,Description,TotalQuantity,TotalRevenue,OrderCount
22275,WEEKEND BAG VINTAGE ROSE PAISLEY,69,527.85,1
21747,SMALL SKULL WINDMILL,437,527.53,42
20832,RED FLOCK LOVE HEART PHOTO FRAME,1034,527.04,55
85130D,BEADED CRYSTAL HEART PINK LARGE,552,526.38,51
16235,RECYCLED PENCIL WITH RABBIT ERASER,2665,525.75,80
21187,WHITE BELL HONEYCOMB PAPER GARLAND ,330,525.3,33
22707,WRAP MONSTER FUN ,1250,525.0,47
23499,SET 12 VINTAGE DOILY CHALK ,1247,523.74,93
22482,BLUE TEA TOWEL CLASSIC DESIGN,448,523.52,48
20785,FUSCHIA RETRO BAR STOOL,14,523.3000000000001,5
23272,TREE T-LIGHT HOLDER WILLIE WINKIE,352,522.7399999999999,35
75131,METAL TUBE CHIME ON BAMBOO,488,522.5600000000001,13
22269,EGG CUP NATURAL CHICKEN,841,521.73,87
23451,SQUARE MINI PORTRAIT FRAME,269,520.9499999999999,44
21261,GREEN GOOSE FEATHER CHRISTMAS TREE ,167,520.6500000000001,27
85049H,URBAN BLACK RIBBONS ,448,520.47,73
84816,DANISH ROSE BEDSIDE CABINET,13,519.35,10
22264,FELT FARM ANIMAL WHITE BUNNY ,1393,518.77,40
22642,SET OF 4 NAPKIN CHARMS STARS   ,253,516.8,43
22543,MINI JIGSAW BAKE A CAKE ,1436,516.61,39
85107,CUT GLASS T-LIGHT HOLDER OCTAGON,243,516.45,25
20932,PINK POT PLANT CANDLE,189,516.25,22
21317,GLASS SPHERE CANDLE STAND MEDIUM,96,516.2,26
22521,CHILDS GARDEN TROWEL PINK,607,515.9499999999999,94
85187,S/12 MINI RABBIT EASTER,324,515.4,58
22233,JIGSAW RABBIT AND BIRDHOUSE,541,515.29,77
22495,SET OF 2 ROUND TINS CAMEMBERT ,242,515.1800000000001,65
23016,GLASS TWIST BON BON JAR,69,512.85,19
85071A,BLUE CHARLIE+LOLA PERSONAL DOORSIGN,976,512.8000000000001,90
35001G,HAND OPEN SHAPE GOLD,157,510.83,24
21926,RED/CREAM STRIPE CUSHION COVER ,414,509.9,60
22068,BLACK PIRATE TREASURE CHEST,437,509.36999999999995,81
22719,GUMBALL MONOCHROME COAT RACK,463,508.07000000000005,34
23060,HEART BEADED TRELLIS DECORATION,244,507.52000000000004,39
21784,SHOE SHINE BOX ,51,507.44999999999993,38
22232,JIGSAW TOADSTOOLS 3 PIECE,623,506.42999999999995,61
22317,FIVE CATS HANGING DECORATION,172,506.32000000000005,39
35971,ROSE FOLKART HEART DECORATIONS,423,504.64,53
23219,LAUREL STAR ANTIQUE SILVER ,404,504.6,49
35599B,BLACK CHRISTMAS TREE 120CM,209,503.85,23
23139,SINGLE WIRE HOOK PINK HEART,407,503.83,22
21925,UNION STRIPE CUSHION COVER ,403,503.75,65
23457,LARGE PARLOUR PICTURE FRAME,105,503.55,29
85104,SILVER GLASS T-LIGHT SET,196,502.47999999999996,14
21383,PACK OF 12 STICKY BUNNIES,772,501.8,77
22420,LIPSTICK PEN BABY PINK,1199,500.33,84
21446,12 RED ROSE PEG PLACE SETTINGS,400,500.0,75
84031A,CHARLIE+LOLA RED HOT WATER BOTTLE ,174,499.78000000000003,49
23398,HANGING HEART BONHEUR,591,499.22999999999996,57
21264,WHITE GOOSE FEATHER TREE 60CM ,256,499.2,42
22050,PINK PAISLEY ROSE GIFT WRAP,1225,498.5,40
85170D,SET/6 PINK BIRD T-LIGHT CANDLES,355,497.21000000000004,51
85169A,IVORY LOVE BIRD CANDLE,502,496.72,48
79067,CORONA MEXICAN TRAY,143,496.25,18
22820,GIFT BAG BIRTHDAY,761,494.83000000000004,45
21638,ASSORTED TUTTI FRUTTI NOTEBOOK,235,493.50000000000006,31
22116,METAL SIGN HIS DINNER IS SERVED,505,493.39000000000004,90
85017B,ENVELOPE 50 BLOSSOM IMAGES,947,491.55,74
20764,ABSTRACT CIRCLES SKETCHBOOK ,128,491.13,60
22166,WALL MIRROR RECTANGLE DIAMANTE PINK,122,489.9000000000001,16
22515,CHILDS GARDEN SPADE PINK,237,488.70000000000005,63
20866,BLUE ROSE FABRIC MIRROR,409,488.59,37
22717,CARD DOG AND BALL ,1170,487.08,87
21059,PARTY INVITES DINOSAURS,573,487.04999999999995,77
21251,DINOSAUR HEIGHT CHART STICKER SET,165,486.75000000000006,35
21277,FRENCH STYLE EMBOSSED HEART CABINET,23,485.9,20
84820,DANISH ROSE TRINKET TRAYS,261,484.63,31
23484,HEART TRELLISTRIPLE T-LIGHT HOLDER,174,483.66,25
23660,HENRIETTA HEN MUG ,293,483.44999999999993,31
22861,EASTER TIN CHICKS IN GARDEN,292,481.79999999999995,38
23691,KEEP CALM BIRTHDAY WRAP,1175,481.5,38
23045,PAPER LANTERN 5 POINT STAR MOON 30,116,481.40000000000003,23
22023,EMPIRE BIRTHDAY CARD,1143,481.29,84
21587,COSY HOUR GIANT TUBE MATCHES,197,480.75,26
22359,GLASS JAR KINGS CHOICE,162,480.74000000000007,62
23021,GLASS BONNE JAM JAR,118,480.1,25
22127,PARTY CONES CARNIVAL ASSORTED,402,479.7,20
21096,SET/6 FRUIT SALAD  PAPER PLATES,1143,479.25,70
84625C,BLUE NEW BAROQUE CANDLESTICK CANDLE,439,478.15,28
85025C,PINK HEART SHAPE PHOTO FRAME,308,477.99999999999994,28
22181,SNOWSTORM PHOTO FRAME FRIDGE MAGNET,577,477.96999999999997,46
21803,CHRISTMAS TREE STAR DECORATION,1138,477.96,49
22496,SET OF 2 ROUND TINS DUTCH CHEESE,243,477.09000000000003,69
85025B,EAU DE NILE HEART SHAPE PHOTO FRAME,305,474.44999999999993,21
21618,4 WILDFLOWER BOTANICAL CANDLES,303,473.75,51
22559,SEASIDE FLYING DISC,387,472.77,39
23180,MUM'S KITCHEN CLOCK,104,471.90000000000003,36
85231G,ORANGE SCENTED SET/9 T-LIGHTS,573,471.45,66
84625A,PINK NEW BAROQUECANDLESTICK CANDLE,455,470.75,31
23377,PACK OF 12 DOLLY GIRL TISSUES,1203,469.16999999999996,80
23043,PAPER LANTERN 9 POINT HOLLY STAR 40,75,468.75,19
21468,BUTTERFLY CROCHET FOOD COVER,123,468.67,50
85032D,YULETIDE IMAGES GIFT WRAP SET,630,467.50000000000006,58
85049F,BABY BOOM RIBBONS ,374,467.5,85
23136,IVORY WIRE SWEETHEART LETTER TRAY,127,467.05,44
22183,CAKE STAND VICTORIAN FILIGREE MED,74,466.95000000000005,17
23218,LAUREL STAR ANTIQUE GOLD,372,465.81,33
35599D,PINK AND WHITE CHRISTMAS TREE 120CM,186,465.38,19
21084,SET/6 COLLAGE PAPER CUPS,2199,463.85,103
21476,STEEL SWEETHEART ROUND TABLE CREAM,31,463.45,18
21865,PINK UNION JACK  PASSPORT COVER ,223,463.38000000000005,68
21634,ASSORTED MINI MADRAS NOTEBOOK,948,462.6,23
85131A,BEADED PEARL HEART WHITE ON STICK,469,462.17,25
21215,IVORY PAPER CUP CAKE CASES ,868,461.8,63
21630,FLOOR CUSHION ELEPHANT CARNIVAL,54,461.3,22
22255,FELT TOADSTOOL  SMALL,542,460.7,44
85016,SET OF 6 VINTAGE NOTELETS KIT,522,459.0,25
23561,SET OF 6 RIBBONS PARTY,167,458.63,13
22324,BLUE POLKADOT KIDS BAG,228,456.35999999999996,29
22511,RETROSPOT BABUSHKA DOORSTOP,245,455.87,48
21014,SWISS CHALET TREE DECORATION ,1233,455.56999999999994,66
23074,EMBOSSED HEART TRINKET BOX,225,452.34000000000003,35
23548,WRAP MAGIC FOREST ,1075,451.5,43
71279,PINK GLASS CANDLEHOLDER,156,450.6000000000001,27
22194,BLACK DINER WALL CLOCK,53,450.5,33
23560,SET OF 6 RIBBONS COUNTRY STYLE,164,449.96,20
35004G,SET OF 3 GOLD FLYING DUCKS,126,448.3,20
21675,BUTTERFLIES STICKERS,525,447.80999999999995,51
85194S,HANGING SPRING FLOWER EGG SMALL,1163,447.75000000000006,55
22261,FELT EGG COSY WHITE RABBIT ,520,447.46,70
21640,ASSORTED TUTTI FRUTTI  FOB NOTEBOOK,541,447.36999999999995,46
23537,I LOVE LONDON WALL ART,98,446.70000000000005,21
21472,LADYBIRD + BEE RAFFIA FOOD COVER,119,446.25,33
21397,BLUE POLKADOT EGG CUP ,1016,445.26,44
17096,ASSORTED LAQUERED INCENSE HOLDERS,2516,443.76000000000005,13
23125,6PC WOOD PLATE SET DISPOSABLE,405,443.25,16
84596L,BISCUITS SMALL BOWL LIGHT BLUE,1039,441.36,79
21650,ASSORTED TUTTI FRUTTI BRACELET,2197,440.89000000000004,61
84707A,SILVER JEWELLED MIRROR TRINKET TRAY,66,440.73999999999995,25
21473,SWEETHEART CREAM STEEL TABLE RECT,22,438.9,18
72819,CUPID DESIGN SCENTED CANDLES,208,436.4,30
17107D,"FLOWER FAIRY,5 SUMMER B'DRAW LINERS",171,436.04999999999995,46
23425,STORAGE TIN HOME SWEET HOME,237,435.43,35
23565,EGG CUP MILKMAID HELGA ,348,435.0,31
23509,MINI PLAYING CARDS FUN FAIR ,1043,434.46000000000004,54
35598B,BLACK CHRISTMAS TREE 60CM,554,433.70000000000005,22
35598D,PINK/WHITE CHRISTMAS TREE 60CM,660,433.22,24
22446,PIN CUSHION BABUSHKA PINK,161,432.99,38
21654,RIDGED GLASS FINGER BOWL,946,432.54,47
23023,RIDGED BONNE JAM JAR T-LIGHT HOLDER,272,431.23999999999995,23
22340,NOEL GARLAND PAINTED ZINC ,993,430.22999999999996,61
21709,FOLDING UMBRELLA CHOCOLATE POLKADOT,87,430.06,31
22647,CERAMIC LOVE HEART MONEY BANK,721,429.84999999999997,36
84674,FLYING PIG WATERING CAN,187,429.25000000000006,40
20705,MRS ROBOT SOFT TOY,143,428.85,28
23379,PACK OF 12 RED APPLE TISSUES,1175,428.01,50
23044,PAPER LANTERN 9 POINT HOLLY STAR S,103,427.45000000000005,24
22903,CALENDAR FAMILY FAVOURITES,153,427.43,32
21062,PARTY INVITES SPACEMAN,501,425.84999999999997,61
85130C,BEADED CRYSTAL HEART BLUE  LARGE,479,425.71,43
21972,SET OF 36 DINOSAUR PAPER DOILIES,292,423.4,39
77101A,UNION FLAG WINDSOCK,386,423.22,20
17012B,ORIGAMI JASMINE INCENSE/CANDLE SET,455,422.54999999999995,36
20766,GARDEN PATH SKETCHBOOK,113,422.08,47
90154,LAZER CUT NECKLACE W PASTEL BEADS,57,421.75,5
23058,CHRISTMAS HANGING SNOWFLAKE,486,421.02000000000004,44
21417,COCKLE SHELL DISH,289,420.88,32
23117,POPPY FIELDS CHOPPING BOARD,85,420.75,39
84976,RECTANGULAR SHAPED MIRROR,502,420.68,29
21711,FOLDING UMBRELLA WHITE/RED POLKADOT,86,420.1,23
21802,CHRISTMAS TREE HEART DECORATION,1000,420.0,46
22051,BLUE SCANDINAVIAN PAISLEY WRAP,1000,420.0,39
20761,BLUE PAISLEY SKETCHBOOK,110,419.92,52
85111,SILVER GLITTER FLOWER VOTIVE HOLDER,1407,419.54999999999995,51
23336,EGG FRYING PAN PINK ,200,418.05,63
21739,COSY SLIPPER SHOES SMALL GREEN,143,417.44000000000005,48
84821,DANISH ROSE DELUXE COASTER,947,417.34999999999997,40
82616B,FRAPPUCINO SCARF KNITTING KIT,308,416.78000000000003,47
21662,VINTAGE GLASS COFFEE CADDY,74,416.3,16
35241,ENAMEL BLUE RIM BISCUIT BIN,89,413.95000000000005,30
90209C,PINK ENAMEL+GLASS HAIR COMB,231,413.7,12
84086C,PINK/PURPLE RETRO RADIO,140,413.00000000000006,19
23459,DOLLY CABINET 2 DRAWERS ,33,412.5,19
21710,FOLDING UMBRELLA PINKWHITE POLKADOT,84,412.41,31
21063,PARTY INVITES JAZZ HEARTS,483,412.10999999999996,81
20839,FRENCH PAISLEY CUSHION COVER ,452,411.84,49
21629,SQUARE FLOOR CUSHION VINTAGE RED,53,411.35,25
21426,WOODLAND STORAGE BOX SMALL,213,411.30000000000007,17
22390,PAPERWEIGHT CHILDHOOD MEMORIES,261,410.71999999999997,30
21358,TOAST ITS - HAPPY BIRTHDAY,328,410.0,59
20658,RED RETROSPOT LUGGAGE TAG,328,410.0,59
21817,GLITTER CHRISTMAS TREE,908,408.86,54
90200D,PINK SWEETHEART BRACELET,99,408.75,24
22513,DOORSTOP FOOTBALL DESIGN,135,408.73,51
21219,SET/4 BADGES BALLOON GIRL,323,408.59,42
22247,BUNNY DECORATION MAGIC GARDEN,485,408.09,56
23422,PANTRY HOOK BALLOON WHISK ,196,407.68,31
84916,HAND TOWEL PALE BLUE W FLOWERS,212,407.4,18
46775D,SUNSET COLOUR CHUNKY KNITTED THROW,24,406.79999999999995,13
20681,PINK POLKADOT CHILDRENS UMBRELLA,125,406.25,33
23415,HOME SWEET HOME HOOK,326,405.59999999999997,45
85136A,YELLOW SHARK HELICOPTER,51,405.45,37
21202,DOLLY HONEYCOMB GARLAND,449,404.85,20
22510,GINGHAM BABUSHKA DOORSTOP,210,404.62,41
21576,LETS GO SHOPPING COTTON TOTE BAG,177,403.67,46
84917,WHITE HAND TOWEL WITH BUTTERFLY,170,400.5,14
21374,MIRRORED WALL ART SKULLS,294,400.0,40
20840,FRENCH FLORAL CUSHION COVER ,464,399.28,43
23466,TUSCAN VILLA DOVECOTE,49,398.25,21
84974,S/2 ZINC HEART DESIGN PLANTERS,40,398.0,28
22422,TOOTHPASTE TUBE PEN,971,397.25,73
85127,SMALL SQUARE CUT GLASS CANDLESTICK,80,396.0,19
22638,SET OF 4 NAPKIN CHARMS CROWNS ,255,394.41999999999996,38
84806B,WHITE CANDYSTUFT ARTIFICIAL FLOWER,296,394.15999999999997,19
22048,BIRTHDAY BANQUET GIFT WRAP,975,393.5,32
21828,EIGHT PIECE SNAKE  SET,314,392.5,68
84849B,FAIRY SOAP SOAP HOLDER,232,392.08,57
22545,MINI JIGSAW BUNNIES,1089,391.10999999999996,47
84826,ASSTD DESIGN 3D PAPER STICKERS,1162,389.38,30
84520B,PACK 20 ENGLISH ROSE PAPER NAPKINS,481,388.69,54
84360,TABLE LAMP WHITE SHADE WOOD BASE,74,388.3,17
21741,COSY SLIPPER SHOES LARGE GREEN,131,386.45000000000005,28
84912A,PINK ROSE WASHBAG,103,386.25,38
20803,SMALL PINK GLASS SUNDAE DISH,917,386.25,31
82616C,MIDNIGHT GLAMOUR SCARF KNITTING KIT,277,385.52,52
85088,CANDY SPOT HAND BAG,188,385.27000000000004,20
47421,ASSORTED COLOUR LIZARD SUCTION HOOK,975,385.02,54
21415,CLAM SHELL SMALL ,206,384.13000000000005,30
22337,ANGEL DECORATION PAINTED ZINC ,635,383.95000000000005,26
18007,ESSENTIAL BALM 3.5g TIN IN ENVELOPE,5856,383.76,17
47585A,PINK FAIRY CAKE CUSHION COVER,102,382.5,27
20762,GREEN FERN SKETCHBOOK ,101,382.46,51
22517,CHILDS GARDEN RAKE PINK,186,381.6,54
85180B,PINK HEARTS LIGHT CHAIN ,196,381.0,21
21373,MIRRORED WALL ART SNOWFLAKES,507,380.25,45
16045,POPART WOODEN PENCILS ASST,8900,380.0,68
21015,DARK BIRD HOUSE TREE DECORATION,1251,377.90999999999997,66
22250,DECORATION  BUTTERFLY  MAGIC GARDEN,449,377.49,57
85078,SCANDINAVIAN 3 HEARTS NAPKIN RING,1746,376.50000000000006,65
84687,BEACH HUT SHELF W 3 DRAWERS,70,376.5,20
35809A,ENAMEL PINK TEA CONTAINER,389,374.94,40
20765,CHRYSANTHEMUM SKETCHBOOK ,96,374.84,51
85135B,BLUE DRAGONFLY HELICOPTER,47,373.65000000000003,34
20716,PARTY FOOD SHOPPER BAG,314,373.5,34
22344,PARTY PIZZA DISH PINK POLKADOT,1049,373.31,46
16011,ANIMAL STICKERS,1773,372.33,46
21318,GLASS CHALICE BLUE SMALL ,680,372.3,40
21581,SKULLS  DESIGN  COTTON TOTE BAG,165,371.25,40
23039,T-LIGHT HOLDER SILVER HEART HANDLE,192,370.79999999999995,22
21808,"CHRISTMAS GARLAND STARS,TREES",100,370.0,21
21562,HAWAIIAN GRASS SKIRT ,319,368.35,25
72799F,IVORY PILLAR CANDLE GOLD FLOCK,128,368.00000000000006,21
21641,ASSORTED TUTTI FRUTTI KEYRING BALL,1102,367.97999999999996,23
84600,NEW BAROQUE JEWELLERY BOX ,48,367.6,20
21635,MADRAS NOTEBOOK LARGE ,270,367.5,15
21194,PINK  HONEYCOMB PAPER FAN,437,366.70000000000005,41
17012D,ORIGAMI ROSE INCENSE/CANDLE SET ,387,366.34999999999997,44
47574A,ENGLISH ROSE SCENTED HANGING FLOWER,423,366.25,50
85170C,SET/6 EAU DE NIL BIRD T-LIGHTS,252,366.23,29
22201,FRYING PAN BLUE POLKADOT,108,366.0,40
21846,PINK DIAMANTE PEN IN GIFT BOX,72,365.62,24
72598,SET/12 TAPER CANDLES,459,364.95,41
35637A,IVORY STRING CURTAIN WITH POLE ,166,363.7,24
21356,TOAST ITS - FAIRY FLOWER,304,363.15,53
16008,SMALL FOLDING SCISSOR(POINTED EDGE),2892,360.71,70
22532,MAGIC DRAWING SLATE LEAP FROG ,1063,360.06,66
21365,MIRRORED WALL ART STARS,348,360.0,42
84632,DECORATIVE HANGING SHELVING UNIT,6,359.70000000000005,5
23429,RED RETRO KITCHEN WALL CLOCK,44,358.6,20
21285,RETROSPOT CANDLE  MEDIUM,350,357.62,33
22308,TEA COSY BLUE STRIPE,145,356.89,36
22230,JIGSAW TREE WITH WATERING CAN,926,356.46,63
21348,PINK SPOTS CHOCOLATE NESTING BOXES ,139,355.65,5
85169C,EAU DE NIL LOVE BIRD CANDLE,336,353.72,21
22260,FELT EGG COSY BLUE RABBIT ,410,351.62,47
23337,EGG FRYING PAN MINT ,169,351.52000000000004,60
22405,MONEY BOX POCKET MONEY DESIGN,347,351.19,54
21061,PARTY INVITES FOOTBALL,412,350.2,52
22516,CHILDS GARDEN RAKE BLUE,171,350.1,41
85163A,WHITE BAROQUE WALL CLOCK ,45,349.95,18
85232A,SET/3 POLKADOT STACKING TINS,74,349.5,25
20998,ROSE DU SUD OVEN GLOVE,119,348.25000000000006,28
21579,LOLITA  DESIGN  COTTON TOTE BAG,154,346.5,32
21664,RIDGED GLASS STORAGE JAR CREAM LID,97,346.47,17
23576,SNACK TRAY RED VINTAGE DOILY,185,346.34999999999997,29
23150,IVORY SWEETHEART SOAP DISH,139,346.11,40
21088,SET/6 FRUIT SALAD PAPER CUPS,1576,345.42,74
21421,PORCELAIN ROSE LARGE ,298,345.14,13
21689,SILVER VANILLA  FLOWER CANDLE POT,92,345.0,23
17012C,ORIGAMI LAVENDER INCENSE/CANDL SET ,363,344.34999999999997,43
22640,SET OF 4 NAPKIN CHARMS 3 KEYS ,186,344.21999999999997,41
84031B,CHARLIE LOLA BLUE HOT WATER BOTTLE ,94,342.74,37
84931B,BLUE SCOTTIE DOG W FLOWER PATTERN,134,341.7,25
84766,SILVER ROCOCO CANDLE STICK,146,340.7,14
84569D,PACK 6 HEART/ICE-CREAM PATCHES,269,338.67,34
22406,MONEY BOX KINGS CHOICE DESIGN,319,336.89,64
23661,MILK MAIDS MUG ,204,336.59999999999997,23
21867,PINK UNION JACK  LUGGAGE TAG,266,336.27,75
90149,SILVER FLOWR PINK SHELL NECKLACE,52,335.28000000000003,3
22643,SET OF 4 NAPKIN CHARMS LEAVES   ,185,334.63,30
22229,BUNNY WOODEN PAINTED WITH FLOWER ,495,334.27,62
22265,EASTER DECORATION NATURAL CHICK,514,334.1,48
85163B,BLACK BAROQUE WALL CLOCK ,44,333.6,14
23047,PAPER LANTERN 5 POINT SEQUIN STAR,58,333.5,25
23420,PANTRY HOOK TEA STRAINER ,160,332.8,28
21129,SILVER FISHING GNOME ,45,332.3,20
22322,BIRD DECORATION GREEN POLKADOT,390,331.5,37
84926E,FLOWERS TILE COASTER,990,329.84,37
22529,MAGIC DRAWING SLATE GO TO THE FAIR ,816,329.76,61
84616,SILVER ROCCOCO CHANDELIER,11,329.45,6
17012F,ORIGAMI SANDLEWOOD INCENSE/CAND SET,365,329.05,42
23116,VEGETABLE GARDEN CHOPPING BOARD,72,327.6,17
22256,FELT FARM ANIMAL CHICKEN,262,327.5,33
47310M,"SMALL POP BOX,FUNKY MONKEY",265,326.73,47
16259,PIECE OF CAMO STATIONERY SET,3380,326.56,31
85230B,CINNAMON SCENTED VOTIVE CANDLE,1264,326.23999999999995,38
84913B,MINT GREEN ROSE TOWEL,70,325.5,20
84663A,GRASS HOPPER WOODEN WALL CLOCK ,260,324.04,25
21197,MULTICOLOUR  CONFETTI IN TUBE,243,322.71,13
84658,WHITE STITCHED CUSHION COVER,46,322.38,16
21263,GREEN GOOSE FEATHER TREE 60CM,165,321.75,36
22248,DECORATION  PINK CHICK MAGIC GARDEN,383,321.39,44
23421,PANTRY HOOK SPATULA,154,320.32,26
20768,GREEN FERN JOURNAL ,131,320.26,36
21884,CAKES AND BOWS GIFT  TAPE,1017,318.81,44
22345,PARTY PIZZA DISH BLUE POLKADOT,972,318.47999999999996,41
84951B,SET OF 4 BLACK LOVEBIRD COASTERS,334,318.44,31
21724,PANDA AND BUNNIES STICKER SHEET,372,316.2,57
21881,CUTE CATS TAPE,975,315.55,45
21723,ALPHABET HEARTS STICKER SHEET,371,315.34999999999997,38
23037,CANDLE HOLDER SILVER MADELINE,193,315.28999999999996,18
84951A,SET OF 4 PISTACHIO LOVEBIRD COASTER,363,315.06,33
84659A,WHITE TRAVEL ALARM CLOCK,134,314.31,22
21775,DECORATIVE FLORE BATHROOM BOTTLE,283,313.91,41
85071C,"CHARLIE+LOLA""EXTREMELY BUSY"" SIGN",607,313.78,72
21284,RETROSPOT CANDLE  SMALL,385,313.53,25
22162,HEART GARLAND RUSTIC PADDED,106,312.7,27
22092,BLUE PAISLEY TISSUE BOX,668,312.34000000000003,88
21220,SET/4 BADGES DOGS,239,312.06,41
23339,EGG FRYING PAN BLUE ,150,312.0,58
90200E,GREEN SWEETHEART BRACELET,76,311.0,18
21841,BABY MOUSE RED GINGHAM DRESS,73,310.25,20
16219,HOUSE SHAPE PENCIL SHARPENER,2915,309.9,47
22346,PARTY PIZZA DISH GREEN POLKADOT,885,309.69,32
21320,GLASS CHALICE GREEN  LARGE ,186,309.66,11
23478,WOODLAND LARGE PINK FELT HEART,278,307.18,10
22100,SKULLS SQUARE TISSUE BOX,729,305.81,38
23575,SNACK TRAY PAISLEY PARK,164,305.4,22
23015,CORDIAL GLASS JUG,37,305.25,15
22040,BOTANICAL ROSE GIFT WRAP,725,304.5,28
21879,HEARTS GIFT TAPE,1027,303.23,57
21060,PARTY INVITES BALLOON GIRL,356,302.59999999999997,53
22204,MILK PAN BLUE POLKADOT,96,302.5,30
85213,MINI  ZINC GARDEN DECORATIONS ,821,301.36999999999995,24
21761,WOOD AND GLASS MEDICINE CABINET,10,299.5,10
23440,PAINT YOUR OWN EGGS IN CRATE,164,299.36,5
85208,SET/12 FUNKY FELT FLOWER PEG IN BAG,161,298.74,24
23695,DOILY THANK YOU CARD,727,296.7,44
85205B,PINK FELT EASTER RABBIT GARLAND,116,295.8,24
20934,SET/3 POT PLANT CANDLES,54,294.3,20
35095A,BLUE VICTORIAN FABRIC OVAL BOX,811,293.82,34
22598,CHRISTMAS MUSICAL ZINC TREE,815,291.33,51
17129F,BLUE GLASS GEMS IN BAG,427,291.25,19
21131,GOLD STANDING GNOME,93,290.25,17
23410,CURIO CABINET LINEN AND LACE ,36,290.1,18
16015,MEDIUM CHINESE STYLE SCISSOR,662,289.98,24
85024B,EAU DE NILE JEWELLED PHOTOFRAME,193,289.65,12
22486,PLASMATRONIC LAMP,52,288.94,10
21503,TOYBOX  WRAP ,726,288.92,23
84358,FLOOR LAMP SHADE WOOD BASE,32,287.74,12
23430,BLUE RETRO KITCHEN WALL CLOCK,35,285.25,17
90160C,TURQ+RED BOUDICCA LARGE BRACELET,41,284.95000000000005,16
90200B,BLACK SWEETHEART BRACELET,67,284.75,24
21128,GOLD FISHING GNOME,47,284.16,16
35912B,WHITE/PINK CHICK DECORATION,249,283.89,18
37413,ICON MUG REVOLUTIONARY,701,283.71,79
22043,CHRISTMAS CARD SCREEN PRINT ,1188,283.32,43
20838,FRENCH LATTICE CUSHION COVER ,330,282.94,33
84915,HAND TOWEL PINK FLOWER AND DAISY,199,281.95,11
84924A,WAKE UP COCKEREL CALENDAR SIGN ,72,281.13,24
71101E,STANDING FAIRY POLE SUPPORT ,348,280.2,22
23579,SNACK TRAY I LOVE LONDON,151,280.05,24
22547,MINI JIGSAW DINOSAUR ,738,279.51,50
21286,RETROSPOT CANDLE  LARGE,255,279.37,18
85136C,RED SHARK HELICOPTER,35,278.25,25
35095B,RED VICTORIAN FABRIC OVAL BOX,772,277.44,41
72122,COFFEE SCENT PILLAR CANDLE,292,277.4,44
16169M,WRAP DAISY CARPET ,660,277.2,25
21850,BLUE  DIAMANTE PEN IN GIFT BOX,61,276.75,21
22049,WRAP CHRISTMAS SCREEN PRINT,1025,275.25,31
21371,MIRRORED WALL ART POPPIES,275,274.65,32
84920,PINK FLOWER FABRIC PONY,73,273.75,26
84509C,SET OF 4 POLKADOT PLACEMATS ,78,273.3,23
20936,FORKED CACTUS CANDLE,92,272.98,26
20831,GOLD PHOTO FRAME,169,272.34000000000003,24
21189,WHITE HONEYCOMB PAPER GARLAND ,165,272.25,29
82613D,METAL SIGN CUPCAKE SINGLE HOOK,470,272.1,50
21248,DOOR HANGER  MUM + DADS ROOM,187,271.15,52
72800B, 4 PURPLE FLOCK DINNER CANDLES,140,270.76,36
21454,PAINTED PINK RABBIT ,318,270.29999999999995,43
35001W,HAND OPEN SHAPE DECO.WHITE,92,270.02000000000004,5
22409,MONEY BOX BISCUITS DESIGN,216,270.0,45
82613B,"METAL SIGN,CUPCAKE SINGLE HOOK",401,268.85,45
21644,ASSORTED TUTTI FRUTTI HEART BOX,215,268.75,32
21785,RAIN PONCHO ,411,267.95,4
21445,12 PINK ROSE PEG PLACE SETTINGS,214,267.5,21
85230E,STRAWBRY SCENTED VOTIVE CANDLE,1101,267.45,24
84926D,LA PALMIERA TILE COASTER,705,266.64,31
16236,KITTY PENCIL ERASERS,1296,266.56,73
23481,PEARLISED IVORY HEART SMALL ,217,266.21,27
16238,PARTY TIME PENCIL ERASERS,1261,265.51,78
79051A,SMOKEY GREY COLOUR D.O.F. GLASS,791,265.39,37
21167,WHITE SAGE INCENSE,1260,264.6,25
72586,SET OF 6 HALLOWEEN GHOST T-LIGHTS,626,262.92,37
85019C,CURIOUS  IMAGES NOTEBOOK SET,181,262.25,10
21221,SET/4 BADGES CUTE CREATURES,201,262.14,24
84598,BOYS ALPHABET IRON ON PATCHES,1248,262.08,5
84849A,HELLO SAILOR BLUE SOAP HOLDER,155,261.95,31
16012,FOOD/DRINK SPONGE STICKERS,1244,261.24,35
21849,SILVER DIAMANTE PEN IN GIFT BOX,52,260.74,22
79337,BLUE FLOCK GLASS CANDLEHOLDER,644,259.96,10
71270,PHOTO CLIP LINE,207,259.96,31
20770,ABSTRACT CIRCLE JOURNAL ,108,259.2,28
21403,BLUE EGG  SPOON,1718,258.71999999999997,71
17013D,ORIGAMI ROSE INCENSE IN TUBE,532,257.88,11
21386,IVORY HANGING DECORATION  EGG,713,257.57,46
22765,NEWSPAPER STAND,25,257.37,3
21222,SET/4 BADGES BEETLES,198,257.18,35
85230G,ORANGE VOTIVE CANDLE,1032,257.03999999999996,25
21250,SET OF SKULL WALL STICKERS,92,257.0,17
84708B,PINK JEWELLED PHOTO FRAME ,53,256.75,14
85188A,GREEN METAL SWINGING BUNNY,302,256.7,34
20854,BLUE PATCH PURSE PINK HEART,166,256.09999999999997,17
21719,LOVELY BONBON STICKER SHEET,301,255.85,34
22134,LADLE LOVE HEART RED ,637,255.18,55
90062,CARNIVAL BRACELET,20,255.0,6
84876B,GREEN HEART COMPACT MIRROR,203,253.75,20
20684,STRAWBERRY DREAM CHILDS UMBRELLA,78,253.5,32
35954,SMALL FOLKART STAR CHRISTMAS DEC,1124,253.35000000000002,32
23137,ZINC WIRE SWEETHEART LETTER TRAY,80,253.24,20
16218,CARTOON  PENCIL SHARPENERS,3760,253.2,50
84596E,SMALL LICORICE DES PINK BOWL,392,253.05,35
84341B,SMALL PINK MAGIC CHRISTMAS TREE,618,252.23,33
47563A,RETRO LONGBOARD IRONING BOARD COVER,199,251.25,45
84858C,PINK RIVIERA HANDBAG,185,250.05,5
21666,RIDGED GLASS T-LIGHT HOLDER,384,249.60000000000002,33
21265,PINK GOOSE FEATHER TREE 60CM,128,249.59999999999997,16
85204,HANGING WOOD AND FELT FLOWER,1876,249.48,42
22703,PINK CAT BOWL,168,249.42000000000002,40
21067,VINTAGE RED TEATIME MUG,203,249.38,41
84859A,SILVER DISCO HANDBAG,123,248.20999999999998,30
20755,BLUE PAISLEY POCKET BOOK,292,248.2,50
78124,MAGAZINE RACK GEBRA ASSORTED ,191,247.75,17
23476,WOODLAND LARGE RED FELT HEART,198,247.5,18
84952B,BLACK LOVE BIRD T-LIGHT HOLDER,145,247.46,13
35964,FOLKART CLIP ON STARS,624,246.78,37
22214,CANDLE PLATE LACE WHITE,114,246.7,21
22108,PING! MICROWAVE PLATE,101,246.53,28
23474,WOODLAND SMALL BLUE FELT HEART,297,246.51,27
21647,ASSORTED TUTTI FRUTTI LARGE PURSE,117,245.70000000000002,24
21190,PINK HEARTS PAPER GARLAND,168,245.20000000000002,7
79190B,RETRO PLASTIC POLKA TRAY,655,245.1,35
17012A,ORIGAMI VANILLA INCENSE/CANDLE SET ,270,244.89999999999998,24
84247E,PACK/12 XMAS FUN CARD,83,244.85000000000002,23
20669,RED HEART LUGGAGE TAG,195,243.75,42
23149,ANTIQUE IVORY WIRE BOWL SMALL,97,241.53000000000003,19
85129D,BEADED CRYSTAL HEART PINK SMALL,166,241.38,34
22259,FELT FARM ANIMAL HEN,384,240.96,16
22069,BROWN  PIRATE TREASURE CHEST ,220,240.77999999999997,37
20622,VIPPASSPORT COVER ,163,240.18,32
23495,SET OF 3 PANTRY WOODEN SPOONS,192,240.0,24
84569A,PACK 3 IRON ON DOG PATCHES,191,239.96,26
22052,VINTAGE CARAVAN GIFT WRAP,571,239.82,23
72131,COLUMBIAN CANDLE RECTANGLE,137,238.34999999999997,18
21269,ANTIQUE CREAM CUTLERY SHELF ,28,238.0,18
85203,HANGING WOOD AND FELT BUTTERFLY ,570,237.96,49
21632,VINTAGE PINK DECORATIVE PARASOL,60,237.00000000000003,5
85169D,PINK LOVE BIRD CANDLE,232,236.48000000000002,22
22512,DOORSTOP RACING CAR DESIGN,118,236.0,32
82613C,"METAL SIGN,CUPCAKE SINGLE HOOK",361,235.45,37
72800C,4 PINK DINNER CANDLE SILVER FLOCK,126,235.06,30
47351B,BLUE  VOILE LAMPSHADE,86,234.5,9
23567,EGG CUP HENRIETTA HEN PINK,187,233.75,18
20615,BLUE POLKADOT PASSPORT COVER,231,233.34,35
21725,SWEETIES  STICKERS,274,232.89999999999998,32
85023B,EAU DE NILE JEWELLED PHOTOFRAME,104,232.8,12
90058B,CRYSTAL STUD EARRINGS ASSORTED COL ,612,232.56,15
23475,WOODLAND SMALL PINK FELT HEART,280,232.39999999999998,26
21442,GREEN BIRDHOUSE DECORATION,389,232.01,36
84559A,3D SHEET OF DOG STICKERS,272,231.98,42
23447,PINK BUNNY EASTER EGG BASKET,158,231.89999999999998,4
20867,PINK ROSE FABRIC MIRROR,187,231.47,25
23465,TUSCAN VILLA FEEDING STATION,28,231.0,15
20856,DENIM PATCH PURSE PINK BUTTERFLY,140,231.0,27
21973,SET OF 36 MUSHROOM PAPER DOILIES,159,230.54999999999998,30
47021G,SET/6 BEAD COASTERS GAUZE BAG GOLD,518,230.39999999999998,15
20897,VINTAGE NOTEBOOK PARIS DAYS,85,230.35,8
21455,PAINTED YELLOW WOODEN DAISY,271,230.35,32
23446,BLUE BUNNY EASTER EGG BASKET,157,230.24999999999997,3
21051,RIBBONS PURSE ,108,228.83,24
23036,T-LIGHT HOLDER SILVER PETIT FOUR ,183,228.75,15
85200,BUNNY EGG BOX,183,228.75,26
85093,CANDY SPOT EGG WARMER HARE,451,227.49,20
16216,LETTER SHAPE PENCIL SHARPENER,3316,227.14,41
84678,CLASSICAL ROSE SMALL VASE,138,227.1,10
22641,SET OF 4 NAPKIN CHARMS INSTRUMENT,112,225.92,24
23003,TRAVEL CARD WALLET VINTAGE ROSE ,541,225.78,52
84661B,BLACK SQUARE TABLE CLOCK,95,225.48999999999998,12
84952C,MIRROR LOVE BIRD T-LIGHT HOLDER,140,225.0,9
22280,POCKET BAG PINK PAISELY BROWN SPOT,177,224.88,30
22447,PIN CUSHION BABUSHKA BLUE,75,223.95000000000002,16
21441,BLUE BIRDHOUSE DECORATION,376,223.3,38
90161C,ANT COPPER LIME BOUDICCA BRACELET,45,222.75,15
90161B,ANT COPPER TURQ BOUDICCA BRACELET,45,222.75,12
85040B,SET/4 BLUE FLOWER CANDLES IN BOWL,135,222.74999999999997,34
90160D,PINK BOUDICCA LARGE BRACELET,32,222.4,9
84218,BOX/12 CHICK & EGG IN BASKET,122,222.29999999999998,40
85161,ACRYLIC GEOMETRIC LAMP,12,221.39999999999998,9
